root@ubuntu-s-1vcpu-1gb-tor1-01:~# tcpdump -i eth0 tcp
tcpdump: verbose output suppressed, use -v[v]... for full protocol decode
listening on eth0, link-type EN10MB (Ethernet), snapshot length 262144 bytes
19:19:42.094416 IP ubuntu-s-1vcpu-1gb-tor1-01.ssh > cpe00fc8d403183-cm00fc8d403180.cpe.net.cable.rogers.com.62841: Flags [P.], seq 261412187:261412295, ack 472347755, win 501, options [nop,nop,TS val 1730238418 ecr 407624490], length 108
19:19:42.094523 IP ubuntu-s-1vcpu-1gb-tor1-01.ssh > cpe00fc8d403183-cm00fc8d403180.cpe.net.cable.rogers.com.62841: Flags [P.], seq 108:264, ack 1, win 501, options [nop,nop,TS val 1730238419 ecr 407624490], length 156
19:19:42.094589 IP ubuntu-s-1vcpu-1gb-tor1-01.ssh > cpe00fc8d403183-cm00fc8d403180.cpe.net.cable.rogers.com.62841: Flags [P.], seq 264:368, ack 1, win 501, options [nop,nop,TS val 1730238419 ecr 407624490], length 104
19:19:42.108188 IP cpe00fc8d403183-cm00fc8d403180.cpe.net.cable.rogers.com.62841 > ubuntu-s-1vcpu-1gb-tor1-01.ssh: Flags [.], ack 368, win 6997, options [nop,nop,TS val 407624585 ecr 1730238419], length 0
19:19:42.192589 IP ubuntu-s-1vcpu-1gb-tor1-01.49002 > 67.207.67.3.domain: Flags [S], seq 712145613, win 64240, options [mss 1460,sackOK,TS val 1942899155 ecr 0,nop,wscale 7,tfo  cookiereq,nop,nop], length 0
19:19:42.193831 IP 67.207.67.3.domain > ubuntu-s-1vcpu-1gb-tor1-01.49002: Flags [S.], seq 2934969508, ack 712145614, win 65160, options [mss 1460,sackOK,TS val 3581204166 ecr 1942899155,nop,wscale 9], length 0
19:19:42.193865 IP ubuntu-s-1vcpu-1gb-tor1-01.49002 > 67.207.67.3.domain: Flags [.], ack 1, win 502, options [nop,nop,TS val 1942899156 ecr 3581204166], length 0
19:19:42.193921 IP ubuntu-s-1vcpu-1gb-tor1-01.49002 > 67.207.67.3.domain: Flags [P.], seq 1:47, ack 1, win 502, options [nop,nop,TS val 1942899156 ecr 3581204166], length 46 27136+ PTR? 13.154.235.99.in-addr.arpa. (44)
19:19:42.194364 IP 67.207.67.3.domain > ubuntu-s-1vcpu-1gb-tor1-01.49002: Flags [.], ack 47, win 128, options [nop,nop,TS val 3581204167 ecr 1942899156], length 0
19:19:42.194496 IP 67.207.67.3.domain > ubuntu-s-1vcpu-1gb-tor1-01.49002: Flags [P.], seq 1:116, ack 47, win 128, options [nop,nop,TS val 3581204167 ecr 1942899156], length 115 27136 1/0/0 PTR cpe00fc8d403183-cm00fc8d403180.cpe.net.cable.rogers.com. (113)
19:19:42.194506 IP ubuntu-s-1vcpu-1gb-tor1-01.49002 > 67.207.67.3.domain: Flags [.], ack 116, win 502, options [nop,nop,TS val 1942899157 ecr 3581204167], length 0
19:19:42.195191 IP ubuntu-s-1vcpu-1gb-tor1-01.ssh > cpe00fc8d403183-cm00fc8d403180.cpe.net.cable.rogers.com.62841: Flags [P.], seq 368:644, ack 1, win 501, options [nop,nop,TS val 1730238519 ecr 407624585], length 276
19:19:42.195319 IP ubuntu-s-1vcpu-1gb-tor1-01.ssh > cpe00fc8d403183-cm00fc8d403180.cpe.net.cable.rogers.com.62841: Flags [P.], seq 644:932, ack 1, win 501, options [nop,nop,TS val 1730238519 ecr 407624585], length 288
19:19:42.195417 IP ubuntu-s-1vcpu-1gb-tor1-01.ssh > cpe00fc8d403183-cm00fc8d403180.cpe.net.cable.rogers.com.62841: Flags [P.], seq 932:968, ack 1, win 501, options [nop,nop,TS val 1730238519 ecr 407624585], length 36
19:19:42.195436 IP ubuntu-s-1vcpu-1gb-tor1-01.ssh > cpe00fc8d403183-cm00fc8d403180.cpe.net.cable.rogers.com.62841: Flags [P.], seq 968:1220, ack 1, win 501, options [nop,nop,TS val 1730238519 ecr 407624585], length 252
19:19:42.195556 IP ubuntu-s-1vcpu-1gb-tor1-01.ssh > cpe00fc8d403183-cm00fc8d403180.cpe.net.cable.rogers.com.62841: Flags [P.], seq 1220:1500, ack 1, win 501, options [nop,nop,TS val 1730238520 ecr 407624585], length 280
19:19:42.195662 IP ubuntu-s-1vcpu-1gb-tor1-01.ssh > cpe00fc8d403183-cm00fc8d403180.cpe.net.cable.rogers.com.62841: Flags [P.], seq 1500:1536, ack 1, win 501, options [nop,nop,TS val 1730238520 ecr 407624585], length 36
19:19:42.212129 IP cpe00fc8d403183-cm00fc8d403180.cpe.net.cable.rogers.com.62841 > ubuntu-s-1vcpu-1gb-tor1-01.ssh: Flags [.], ack 1536, win 6984, options [nop,nop,TS val 407624687 ecr 1730238520], length 0
19:19:42.296684 IP ubuntu-s-1vcpu-1gb-tor1-01.49002 > 67.207.67.3.domain: Flags [P.], seq 47:91, ack 116, win 502, options [nop,nop,TS val 1942899259 ecr 3581204167], length 44 10622+ PTR? 3.67.207.67.in-addr.arpa. (42)
19:19:42.297436 IP 67.207.67.3.domain > ubuntu-s-1vcpu-1gb-tor1-01.49002: Flags [P.], seq 116:227, ack 91, win 128, options [nop,nop,TS val 3581204270 ecr 1942899259], length 111 10622 NXDomain 0/1/0 (109)
19:19:42.297480 IP ubuntu-s-1vcpu-1gb-tor1-01.49002 > 67.207.67.3.domain: Flags [.], ack 227, win 502, options [nop,nop,TS val 1942899259 ecr 3581204270], length 0
19:19:42.298450 IP ubuntu-s-1vcpu-1gb-tor1-01.ssh > cpe00fc8d403183-cm00fc8d403180.cpe.net.cable.rogers.com.62841: Flags [P.], seq 1536:1780, ack 1, win 501, options [nop,nop,TS val 1730238622 ecr 407624687], length 244
19:19:42.298607 IP ubuntu-s-1vcpu-1gb-tor1-01.ssh > cpe00fc8d403183-cm00fc8d403180.cpe.net.cable.rogers.com.62841: Flags [P.], seq 1780:1816, ack 1, win 501, options [nop,nop,TS val 1730238623 ecr 407624687], length 36
19:19:42.298702 IP ubuntu-s-1vcpu-1gb-tor1-01.ssh > cpe00fc8d403183-cm00fc8d403180.cpe.net.cable.rogers.com.62841: Flags [P.], seq 1816:2060, ack 1, win 501, options [nop,nop,TS val 1730238623 ecr 407624687], length 244
19:19:42.299308 IP ubuntu-s-1vcpu-1gb-tor1-01.ssh > cpe00fc8d403183-cm00fc8d403180.cpe.net.cable.rogers.com.62841: Flags [P.], seq 2060:2616, ack 1, win 501, options [nop,nop,TS val 1730238623 ecr 407624687], length 556
19:19:42.299449 IP ubuntu-s-1vcpu-1gb-tor1-01.ssh > cpe00fc8d403183-cm00fc8d403180.cpe.net.cable.rogers.com.62841: Flags [P.], seq 2616:2848, ack 1, win 501, options [nop,nop,TS val 1730238623 ecr 407624687], length 232
19:19:42.299576 IP ubuntu-s-1vcpu-1gb-tor1-01.ssh > cpe00fc8d403183-cm00fc8d403180.cpe.net.cable.rogers.com.62841: Flags [P.], seq 2848:3140, ack 1, win 501, options [nop,nop,TS val 1730238624 ecr 407624687], length 292
19:19:42.299677 IP ubuntu-s-1vcpu-1gb-tor1-01.ssh > cpe00fc8d403183-cm00fc8d403180.cpe.net.cable.rogers.com.62841: Flags [P.], seq 3140:3176, ack 1, win 501, options [nop,nop,TS val 1730238624 ecr 407624687], length 36
19:19:42.299729 IP ubuntu-s-1vcpu-1gb-tor1-01.ssh > cpe00fc8d403183-cm00fc8d403180.cpe.net.cable.rogers.com.62841: Flags [P.], seq 3176:3380, ack 1, win 501, options [nop,nop,TS val 1730238624 ecr 407624687], length 204
19:19:42.299845 IP ubuntu-s-1vcpu-1gb-tor1-01.ssh > cpe00fc8d403183-cm00fc8d403180.cpe.net.cable.rogers.com.62841: Flags [P.], seq 3380:3668, ack 1, win 501, options [nop,nop,TS val 1730238624 ecr 407624687], length 288
19:19:42.299945 IP ubuntu-s-1vcpu-1gb-tor1-01.ssh > cpe00fc8d403183-cm00fc8d403180.cpe.net.cable.rogers.com.62841: Flags [P.], seq 3668:3704, ack 1, win 501, options [nop,nop,TS val 1730238624 ecr 407624687], length 36
19:19:42.300103 IP ubuntu-s-1vcpu-1gb-tor1-01.ssh > cpe00fc8d403183-cm00fc8d403180.cpe.net.cable.rogers.com.62841: Flags [P.], seq 3704:3956, ack 1, win 501, options [nop,nop,TS val 1730238624 ecr 407624687], length 252
19:19:42.300222 IP ubuntu-s-1vcpu-1gb-tor1-01.ssh > cpe00fc8d403183-cm00fc8d403180.cpe.net.cable.rogers.com.62841: Flags [P.], seq 3956:4244, ack 1, win 501, options [nop,nop,TS val 1730238624 ecr 407624687], length 288
19:19:42.300460 IP ubuntu-s-1vcpu-1gb-tor1-01.ssh > cpe00fc8d403183-cm00fc8d403180.cpe.net.cable.rogers.com.62841: Flags [P.], seq 4244:4864, ack 1, win 501, options [nop,nop,TS val 1730238624 ecr 407624687], length 620
19:19:42.300571 IP ubuntu-s-1vcpu-1gb-tor1-01.ssh > cpe00fc8d403183-cm00fc8d403180.cpe.net.cable.rogers.com.62841: Flags [P.], seq 4864:5152, ack 1, win 501, options [nop,nop,TS val 1730238625 ecr 407624687], length 288
19:19:42.300692 IP ubuntu-s-1vcpu-1gb-tor1-01.ssh > cpe00fc8d403183-cm00fc8d403180.cpe.net.cable.rogers.com.62841: Flags [P.], seq 5152:5432, ack 1, win 501, options [nop,nop,TS val 1730238625 ecr 407624687], length 280
19:19:42.315370 IP cpe00fc8d403183-cm00fc8d403180.cpe.net.cable.rogers.com.62841 > ubuntu-s-1vcpu-1gb-tor1-01.ssh: Flags [.], ack 5432, win 6958, options [nop,nop,TS val 407624791 ecr 1730238625], length 0
19:19:42.399819 IP ubuntu-s-1vcpu-1gb-tor1-01.ssh > cpe00fc8d403183-cm00fc8d403180.cpe.net.cable.rogers.com.62841: Flags [P.], seq 5432:5692, ack 1, win 501, options [nop,nop,TS val 1730238724 ecr 407624791], length 260
19:19:42.399956 IP ubuntu-s-1vcpu-1gb-tor1-01.ssh > cpe00fc8d403183-cm00fc8d403180.cpe.net.cable.rogers.com.62841: Flags [P.], seq 5692:5972, ack 1, win 501, options [nop,nop,TS val 1730238724 ecr 407624791], length 280
19:19:42.400006 IP ubuntu-s-1vcpu-1gb-tor1-01.ssh > cpe00fc8d403183-cm00fc8d403180.cpe.net.cable.rogers.com.62841: Flags [P.], seq 5972:6008, ack 1, win 501, options [nop,nop,TS val 1730238724 ecr 407624791], length 36
19:19:42.400086 IP ubuntu-s-1vcpu-1gb-tor1-01.ssh > cpe00fc8d403183-cm00fc8d403180.cpe.net.cable.rogers.com.62841: Flags [P.], seq 6008:6212, ack 1, win 501, options [nop,nop,TS val 1730238724 ecr 407624791], length 204
19:19:42.400160 IP ubuntu-s-1vcpu-1gb-tor1-01.ssh > cpe00fc8d403183-cm00fc8d403180.cpe.net.cable.rogers.com.62841: Flags [P.], seq 6212:6248, ack 1, win 501, options [nop,nop,TS val 1730238724 ecr 407624791], length 36
19:19:42.400302 IP ubuntu-s-1vcpu-1gb-tor1-01.ssh > cpe00fc8d403183-cm00fc8d403180.cpe.net.cable.rogers.com.62841: Flags [P.], seq 6248:6508, ack 1, win 501, options [nop,nop,TS val 1730238724 ecr 407624791], length 260
19:19:42.400417 IP ubuntu-s-1vcpu-1gb-tor1-01.ssh > cpe00fc8d403183-cm00fc8d403180.cpe.net.cable.rogers.com.62841: Flags [P.], seq 6508:6544, ack 1, win 501, options [nop,nop,TS val 1730238724 ecr 407624791], length 36
19:19:42.400454 IP ubuntu-s-1vcpu-1gb-tor1-01.ssh > cpe00fc8d403183-cm00fc8d403180.cpe.net.cable.rogers.com.62841: Flags [P.], seq 6544:6796, ack 1, win 501, options [nop,nop,TS val 1730238724 ecr 407624791], length 252
19:19:42.400526 IP ubuntu-s-1vcpu-1gb-tor1-01.ssh > cpe00fc8d403183-cm00fc8d403180.cpe.net.cable.rogers.com.62841: Flags [P.], seq 6796:6832, ack 1, win 501, options [nop,nop,TS val 1730238725 ecr 407624791], length 36
19:19:42.400606 IP ubuntu-s-1vcpu-1gb-tor1-01.ssh > cpe00fc8d403183-cm00fc8d403180.cpe.net.cable.rogers.com.62841: Flags [P.], seq 6832:7092, ack 1, win 501, options [nop,nop,TS val 1730238725 ecr 407624791], length 260
19:19:42.400707 IP ubuntu-s-1vcpu-1gb-tor1-01.ssh > cpe00fc8d403183-cm00fc8d403180.cpe.net.cable.rogers.com.62841: Flags [P.], seq 7092:7128, ack 1, win 501, options [nop,nop,TS val 1730238725 ecr 407624791], length 36
19:19:42.400776 IP ubuntu-s-1vcpu-1gb-tor1-01.ssh > cpe00fc8d403183-cm00fc8d403180.cpe.net.cable.rogers.com.62841: Flags [P.], seq 7128:7388, ack 1, win 501, options [nop,nop,TS val 1730238725 ecr 407624791], length 260
19:19:42.400853 IP ubuntu-s-1vcpu-1gb-tor1-01.ssh > cpe00fc8d403183-cm00fc8d403180.cpe.net.cable.rogers.com.62841: Flags [P.], seq 7388:7424, ack 1, win 501, options [nop,nop,TS val 1730238725 ecr 407624791], length 36
19:19:42.400948 IP ubuntu-s-1vcpu-1gb-tor1-01.ssh > cpe00fc8d403183-cm00fc8d403180.cpe.net.cable.rogers.com.62841: Flags [P.], seq 7424:7720, ack 1, win 501, options [nop,nop,TS val 1730238725 ecr 407624791], length 296
19:19:42.401042 IP ubuntu-s-1vcpu-1gb-tor1-01.ssh > cpe00fc8d403183-cm00fc8d403180.cpe.net.cable.rogers.com.62841: Flags [P.], seq 7720:7980, ack 1, win 501, options [nop,nop,TS val 1730238725 ecr 407624791], length 260
19:19:42.401233 IP ubuntu-s-1vcpu-1gb-tor1-01.ssh > cpe00fc8d403183-cm00fc8d403180.cpe.net.cable.rogers.com.62841: Flags [P.], seq 7980:8016, ack 1, win 501, options [nop,nop,TS val 1730238725 ecr 407624791], length 36
19:19:42.401351 IP ubuntu-s-1vcpu-1gb-tor1-01.ssh > cpe00fc8d403183-cm00fc8d403180.cpe.net.cable.rogers.com.62841: Flags [P.], seq 8016:8304, ack 1, win 501, options [nop,nop,TS val 1730238725 ecr 407624791], length 288
19:19:42.401443 IP ubuntu-s-1vcpu-1gb-tor1-01.ssh > cpe00fc8d403183-cm00fc8d403180.cpe.net.cable.rogers.com.62841: Flags [P.], seq 8304:8564, ack 1, win 501, options [nop,nop,TS val 1730238725 ecr 407624791], length 260
19:19:42.401529 IP ubuntu-s-1vcpu-1gb-tor1-01.ssh > cpe00fc8d403183-cm00fc8d403180.cpe.net.cable.rogers.com.62841: Flags [P.], seq 8564:8600, ack 1, win 501, options [nop,nop,TS val 1730238726 ecr 407624791], length 36
19:19:42.401644 IP ubuntu-s-1vcpu-1gb-tor1-01.ssh > cpe00fc8d403183-cm00fc8d403180.cpe.net.cable.rogers.com.62841: Flags [P.], seq 8600:8896, ack 1, win 501, options [nop,nop,TS val 1730238726 ecr 407624791], length 296
19:19:42.401737 IP ubuntu-s-1vcpu-1gb-tor1-01.ssh > cpe00fc8d403183-cm00fc8d403180.cpe.net.cable.rogers.com.62841: Flags [P.], seq 8896:9184, ack 1, win 501, options [nop,nop,TS val 1730238726 ecr 407624791], length 288
19:19:42.401868 IP ubuntu-s-1vcpu-1gb-tor1-01.ssh > cpe00fc8d403183-cm00fc8d403180.cpe.net.cable.rogers.com.62841: Flags [P.], seq 9184:9480, ack 1, win 501, options [nop,nop,TS val 1730238726 ecr 407624791], length 296
19:19:42.401965 IP ubuntu-s-1vcpu-1gb-tor1-01.ssh > cpe00fc8d403183-cm00fc8d403180.cpe.net.cable.rogers.com.62841: Flags [P.], seq 9480:9740, ack 1, win 501, options [nop,nop,TS val 1730238726 ecr 407624791], length 260
19:19:42.402066 IP ubuntu-s-1vcpu-1gb-tor1-01.ssh > cpe00fc8d403183-cm00fc8d403180.cpe.net.cable.rogers.com.62841: Flags [P.], seq 9740:9776, ack 1, win 501, options [nop,nop,TS val 1730238726 ecr 407624791], length 36
19:19:42.402108 IP ubuntu-s-1vcpu-1gb-tor1-01.ssh > cpe00fc8d403183-cm00fc8d403180.cpe.net.cable.rogers.com.62841: Flags [P.], seq 9776:10036, ack 1, win 501, options [nop,nop,TS val 1730238726 ecr 407624791], length 260
19:19:42.402163 IP ubuntu-s-1vcpu-1gb-tor1-01.ssh > cpe00fc8d403183-cm00fc8d403180.cpe.net.cable.rogers.com.62841: Flags [P.], seq 10036:10072, ack 1, win 501, options [nop,nop,TS val 1730238726 ecr 407624791], length 36
19:19:42.402247 IP ubuntu-s-1vcpu-1gb-tor1-01.ssh > cpe00fc8d403183-cm00fc8d403180.cpe.net.cable.rogers.com.62841: Flags [P.], seq 10072:10332, ack 1, win 501, options [nop,nop,TS val 1730238726 ecr 407624791], length 260
19:19:42.402312 IP ubuntu-s-1vcpu-1gb-tor1-01.ssh > cpe00fc8d403183-cm00fc8d403180.cpe.net.cable.rogers.com.62841: Flags [P.], seq 10332:10368, ack 1, win 501, options [nop,nop,TS val 1730238726 ecr 407624791], length 36
19:19:42.402394 IP ubuntu-s-1vcpu-1gb-tor1-01.ssh > cpe00fc8d403183-cm00fc8d403180.cpe.net.cable.rogers.com.62841: Flags [P.], seq 10368:10628, ack 1, win 501, options [nop,nop,TS val 1730238726 ecr 407624791], length 260
19:19:42.402459 IP ubuntu-s-1vcpu-1gb-tor1-01.ssh > cpe00fc8d403183-cm00fc8d403180.cpe.net.cable.rogers.com.62841: Flags [P.], seq 10628:10664, ack 1, win 501, options [nop,nop,TS val 1730238726 ecr 407624791], length 36
19:19:42.402540 IP ubuntu-s-1vcpu-1gb-tor1-01.ssh > cpe00fc8d403183-cm00fc8d403180.cpe.net.cable.rogers.com.62841: Flags [P.], seq 10664:10908, ack 1, win 501, options [nop,nop,TS val 1730238727 ecr 407624791], length 244
19:19:42.418915 IP cpe00fc8d403183-cm00fc8d403180.cpe.net.cable.rogers.com.62841 > ubuntu-s-1vcpu-1gb-tor1-01.ssh: Flags [.], ack 10908, win 6985, options [nop,nop,TS val 407624895 ecr 1730238727], length 0
19:19:42.418997 IP ubuntu-s-1vcpu-1gb-tor1-01.ssh > cpe00fc8d403183-cm00fc8d403180.cpe.net.cable.rogers.com.62841: Flags [P.], seq 10908:10944, ack 1, win 501, options [nop,nop,TS val 1730238743 ecr 407624895], length 36
19:19:42.436299 IP cpe00fc8d403183-cm00fc8d403180.cpe.net.cable.rogers.com.62841 > ubuntu-s-1vcpu-1gb-tor1-01.ssh: Flags [.], ack 10944, win 7002, options [nop,nop,TS val 407624910 ecr 1730238743], length 0
19:19:42.503822 IP ubuntu-s-1vcpu-1gb-tor1-01.ssh > cpe00fc8d403183-cm00fc8d403180.cpe.net.cable.rogers.com.62841: Flags [P.], seq 10944:11204, ack 1, win 501, options [nop,nop,TS val 1730238828 ecr 407624910], length 260
19:19:42.503966 IP ubuntu-s-1vcpu-1gb-tor1-01.ssh > cpe00fc8d403183-cm00fc8d403180.cpe.net.cable.rogers.com.62841: Flags [P.], seq 11204:11500, ack 1, win 501, options [nop,nop,TS val 1730238828 ecr 407624910], length 296
19:19:42.504091 IP ubuntu-s-1vcpu-1gb-tor1-01.ssh > cpe00fc8d403183-cm00fc8d403180.cpe.net.cable.rogers.com.62841: Flags [P.], seq 11500:11824, ack 1, win 501, options [nop,nop,TS val 1730238828 ecr 407624910], length 324
19:19:42.504233 IP ubuntu-s-1vcpu-1gb-tor1-01.ssh > cpe00fc8d403183-cm00fc8d403180.cpe.net.cable.rogers.com.62841: Flags [P.], seq 11824:12120, ack 1, win 501, options [nop,nop,TS val 1730238828 ecr 407624910], length 296
19:19:42.504386 IP ubuntu-s-1vcpu-1gb-tor1-01.ssh > cpe00fc8d403183-cm00fc8d403180.cpe.net.cable.rogers.com.62841: Flags [P.], seq 12120:12408, ack 1, win 501, options [nop,nop,TS val 1730238828 ecr 407624910], length 288
19:19:42.504496 IP ubuntu-s-1vcpu-1gb-tor1-01.ssh > cpe00fc8d403183-cm00fc8d403180.cpe.net.cable.rogers.com.62841: Flags [P.], seq 12408:12704, ack 1, win 501, options [nop,nop,TS val 1730238828 ecr 407624910], length 296
19:19:42.504608 IP ubuntu-s-1vcpu-1gb-tor1-01.ssh > cpe00fc8d403183-cm00fc8d403180.cpe.net.cable.rogers.com.62841: Flags [P.], seq 12704:12992, ack 1, win 501, options [nop,nop,TS val 1730238829 ecr 407624910], length 288
19:19:42.504704 IP ubuntu-s-1vcpu-1gb-tor1-01.ssh > cpe00fc8d403183-cm00fc8d403180.cpe.net.cable.rogers.com.62841: Flags [P.], seq 12992:13252, ack 1, win 501, options [nop,nop,TS val 1730238829 ecr 407624910], length 260
19:19:42.504780 IP ubuntu-s-1vcpu-1gb-tor1-01.ssh > cpe00fc8d403183-cm00fc8d403180.cpe.net.cable.rogers.com.62841: Flags [P.], seq 13252:13540, ack 1, win 501, options [nop,nop,TS val 1730238829 ecr 407624910], length 288
19:19:42.504925 IP ubuntu-s-1vcpu-1gb-tor1-01.ssh > cpe00fc8d403183-cm00fc8d403180.cpe.net.cable.rogers.com.62841: Flags [P.], seq 13540:13576, ack 1, win 501, options [nop,nop,TS val 1730238829 ecr 407624910], length 36
19:19:42.504967 IP ubuntu-s-1vcpu-1gb-tor1-01.ssh > cpe00fc8d403183-cm00fc8d403180.cpe.net.cable.rogers.com.62841: Flags [P.], seq 13576:13836, ack 1, win 501, options [nop,nop,TS val 1730238829 ecr 407624910], length 260
19:19:42.505049 IP ubuntu-s-1vcpu-1gb-tor1-01.ssh > cpe00fc8d403183-cm00fc8d403180.cpe.net.cable.rogers.com.62841: Flags [P.], seq 13836:13872, ack 1, win 501, options [nop,nop,TS val 1730238829 ecr 407624910], length 36
19:19:42.505237 IP ubuntu-s-1vcpu-1gb-tor1-01.ssh > cpe00fc8d403183-cm00fc8d403180.cpe.net.cable.rogers.com.62841: Flags [P.], seq 13872:14124, ack 1, win 501, options [nop,nop,TS val 1730238829 ecr 407624910], length 252
19:19:42.505351 IP ubuntu-s-1vcpu-1gb-tor1-01.ssh > cpe00fc8d403183-cm00fc8d403180.cpe.net.cable.rogers.com.62841: Flags [P.], seq 14124:14420, ack 1, win 501, options [nop,nop,TS val 1730238829 ecr 407624910], length 296
19:19:42.505454 IP ubuntu-s-1vcpu-1gb-tor1-01.ssh > cpe00fc8d403183-cm00fc8d403180.cpe.net.cable.rogers.com.62841: Flags [P.], seq 14420:14456, ack 1, win 501, options [nop,nop,TS val 1730238829 ecr 407624910], length 36
19:19:42.505494 IP ubuntu-s-1vcpu-1gb-tor1-01.ssh > cpe00fc8d403183-cm00fc8d403180.cpe.net.cable.rogers.com.62841: Flags [P.], seq 14456:14708, ack 1, win 501, options [nop,nop,TS val 1730238829 ecr 407624910], length 252
19:19:42.505598 IP ubuntu-s-1vcpu-1gb-tor1-01.ssh > cpe00fc8d403183-cm00fc8d403180.cpe.net.cable.rogers.com.62841: Flags [P.], seq 14708:15004, ack 1, win 501, options [nop,nop,TS val 1730238830 ecr 407624910], length 296
19:19:42.505694 IP ubuntu-s-1vcpu-1gb-tor1-01.ssh > cpe00fc8d403183-cm00fc8d403180.cpe.net.cable.rogers.com.62841: Flags [P.], seq 15004:15336, ack 1, win 501, options [nop,nop,TS val 1730238830 ecr 407624910], length 332
19:19:42.505872 IP ubuntu-s-1vcpu-1gb-tor1-01.ssh > cpe00fc8d403183-cm00fc8d403180.cpe.net.cable.rogers.com.62841: Flags [P.], seq 15336:15624, ack 1, win 501, options [nop,nop,TS val 1730238830 ecr 407624910], length 288
19:19:42.505942 IP ubuntu-s-1vcpu-1gb-tor1-01.ssh > cpe00fc8d403183-cm00fc8d403180.cpe.net.cable.rogers.com.62841: Flags [P.], seq 15624:15920, ack 1, win 501, options [nop,nop,TS val 1730238830 ecr 407624910], length 296
19:19:42.506156 IP ubuntu-s-1vcpu-1gb-tor1-01.ssh > cpe00fc8d403183-cm00fc8d403180.cpe.net.cable.rogers.com.62841: Flags [P.], seq 15920:16180, ack 1, win 501, options [nop,nop,TS val 1730238830 ecr 407624910], length 260
19:19:42.506270 IP ubuntu-s-1vcpu-1gb-tor1-01.ssh > cpe00fc8d403183-cm00fc8d403180.cpe.net.cable.rogers.com.62841: Flags [P.], seq 16180:16468, ack 1, win 501, options [nop,nop,TS val 1730238830 ecr 407624910], length 288
19:19:42.506396 IP ubuntu-s-1vcpu-1gb-tor1-01.ssh > cpe00fc8d403183-cm00fc8d403180.cpe.net.cable.rogers.com.62841: Flags [P.], seq 16468:16504, ack 1, win 501, options [nop,nop,TS val 1730238830 ecr 407624910], length 36
19:19:42.506454 IP ubuntu-s-1vcpu-1gb-tor1-01.ssh > cpe00fc8d403183-cm00fc8d403180.cpe.net.cable.rogers.com.62841: Flags [P.], seq 16504:16764, ack 1, win 501, options [nop,nop,TS val 1730238830 ecr 407624910], length 260
19:19:42.506575 IP ubuntu-s-1vcpu-1gb-tor1-01.ssh > cpe00fc8d403183-cm00fc8d403180.cpe.net.cable.rogers.com.62841: Flags [P.], seq 16764:16800, ack 1, win 501, options [nop,nop,TS val 1730238831 ecr 407624910], length 36
19:19:42.506617 IP ubuntu-s-1vcpu-1gb-tor1-01.ssh > cpe00fc8d403183-cm00fc8d403180.cpe.net.cable.rogers.com.62841: Flags [P.], seq 16800:17060, ack 1, win 501, options [nop,nop,TS val 1730238831 ecr 407624910], length 260
19:19:42.506803 IP ubuntu-s-1vcpu-1gb-tor1-01.ssh > cpe00fc8d403183-cm00fc8d403180.cpe.net.cable.rogers.com.62841: Flags [P.], seq 17060:17096, ack 1, win 501, options [nop,nop,TS val 1730238831 ecr 407624910], length 36
19:19:42.506831 IP ubuntu-s-1vcpu-1gb-tor1-01.ssh > cpe00fc8d403183-cm00fc8d403180.cpe.net.cable.rogers.com.62841: Flags [P.], seq 17096:17356, ack 1, win 501, options [nop,nop,TS val 1730238831 ecr 407624910], length 260
19:19:42.506956 IP ubuntu-s-1vcpu-1gb-tor1-01.ssh > cpe00fc8d403183-cm00fc8d403180.cpe.net.cable.rogers.com.62841: Flags [P.], seq 17356:17688, ack 1, win 501, options [nop,nop,TS val 1730238831 ecr 407624910], length 332
19:19:42.507104 IP ubuntu-s-1vcpu-1gb-tor1-01.ssh > cpe00fc8d403183-cm00fc8d403180.cpe.net.cable.rogers.com.62841: Flags [P.], seq 17688:17976, ack 1, win 501, options [nop,nop,TS val 1730238831 ecr 407624910], length 288
19:19:42.507178 IP ubuntu-s-1vcpu-1gb-tor1-01.ssh > cpe00fc8d403183-cm00fc8d403180.cpe.net.cable.rogers.com.62841: Flags [P.], seq 17976:18272, ack 1, win 501, options [nop,nop,TS val 1730238831 ecr 407624910], length 296
19:19:42.507269 IP ubuntu-s-1vcpu-1gb-tor1-01.ssh > cpe00fc8d403183-cm00fc8d403180.cpe.net.cable.rogers.com.62841: Flags [P.], seq 18272:18568, ack 1, win 501, options [nop,nop,TS val 1730238831 ecr 407624910], length 296
19:19:42.507363 IP ubuntu-s-1vcpu-1gb-tor1-01.ssh > cpe00fc8d403183-cm00fc8d403180.cpe.net.cable.rogers.com.62841: Flags [P.], seq 18568:18864, ack 1, win 501, options [nop,nop,TS val 1730238831 ecr 407624910], length 296
19:19:42.507478 IP ubuntu-s-1vcpu-1gb-tor1-01.ssh > cpe00fc8d403183-cm00fc8d403180.cpe.net.cable.rogers.com.62841: Flags [P.], seq 18864:19160, ack 1, win 501, options [nop,nop,TS val 1730238831 ecr 407624910], length 296
19:19:42.507611 IP ubuntu-s-1vcpu-1gb-tor1-01.ssh > cpe00fc8d403183-cm00fc8d403180.cpe.net.cable.rogers.com.62841: Flags [P.], seq 19160:19456, ack 1, win 501, options [nop,nop,TS val 1730238832 ecr 407624910], length 296
19:19:42.507738 IP ubuntu-s-1vcpu-1gb-tor1-01.ssh > cpe00fc8d403183-cm00fc8d403180.cpe.net.cable.rogers.com.62841: Flags [P.], seq 19456:19752, ack 1, win 501, options [nop,nop,TS val 1730238832 ecr 407624910], length 296
19:19:42.507820 IP ubuntu-s-1vcpu-1gb-tor1-01.ssh > cpe00fc8d403183-cm00fc8d403180.cpe.net.cable.rogers.com.62841: Flags [P.], seq 19752:20292, ack 1, win 501, options [nop,nop,TS val 1730238832 ecr 407624910], length 540
19:19:42.507941 IP ubuntu-s-1vcpu-1gb-tor1-01.ssh > cpe00fc8d403183-cm00fc8d403180.cpe.net.cable.rogers.com.62841: Flags [P.], seq 20292:20328, ack 1, win 501, options [nop,nop,TS val 1730238832 ecr 407624910], length 36
19:19:42.508015 IP ubuntu-s-1vcpu-1gb-tor1-01.ssh > cpe00fc8d403183-cm00fc8d403180.cpe.net.cable.rogers.com.62841: Flags [P.], seq 20328:20588, ack 1, win 501, options [nop,nop,TS val 1730238832 ecr 407624910], length 260
19:19:42.508146 IP ubuntu-s-1vcpu-1gb-tor1-01.ssh > cpe00fc8d403183-cm00fc8d403180.cpe.net.cable.rogers.com.62841: Flags [P.], seq 20588:20868, ack 1, win 501, options [nop,nop,TS val 1730238832 ecr 407624910], length 280
19:19:42.508291 IP ubuntu-s-1vcpu-1gb-tor1-01.ssh > cpe00fc8d403183-cm00fc8d403180.cpe.net.cable.rogers.com.62841: Flags [P.], seq 20868:20904, ack 1, win 501, options [nop,nop,TS val 1730238832 ecr 407624910], length 36
19:19:42.563574 IP ubuntu-s-1vcpu-1gb-tor1-01.ssh > cpe00fc8d403183-cm00fc8d403180.cpe.net.cable.rogers.com.62841: Flags [P.], seq 20868:20904, ack 1, win 501, options [nop,nop,TS val 1730238888 ecr 407624910], length 36
19:19:42.607800 IP ubuntu-s-1vcpu-1gb-tor1-01.ssh > cpe00fc8d403183-cm00fc8d403180.cpe.net.cable.rogers.com.62841: Flags [P.], seq 20904:21164, ack 1, win 501, options [nop,nop,TS val 1730238932 ecr 407624910], length 260
19:19:42.607968 IP ubuntu-s-1vcpu-1gb-tor1-01.ssh > cpe00fc8d403183-cm00fc8d403180.cpe.net.cable.rogers.com.62841: Flags [P.], seq 21164:21460, ack 1, win 501, options [nop,nop,TS val 1730238932 ecr 407624910], length 296
19:19:42.608153 IP ubuntu-s-1vcpu-1gb-tor1-01.ssh > cpe00fc8d403183-cm00fc8d403180.cpe.net.cable.rogers.com.62841: Flags [P.], seq 21460:21792, ack 1, win 501, options [nop,nop,TS val 1730238932 ecr 407624910], length 332
19:19:42.608333 IP ubuntu-s-1vcpu-1gb-tor1-01.ssh > cpe00fc8d403183-cm00fc8d403180.cpe.net.cable.rogers.com.62841: Flags [P.], seq 21792:22348, ack 1, win 501, options [nop,nop,TS val 1730238932 ecr 407624910], length 556
19:19:42.608505 IP ubuntu-s-1vcpu-1gb-tor1-01.ssh > cpe00fc8d403183-cm00fc8d403180.cpe.net.cable.rogers.com.62841: Flags [P.], seq 22348:22644, ack 1, win 501, options [nop,nop,TS val 1730238932 ecr 407624910], length 296
19:19:42.608632 IP ubuntu-s-1vcpu-1gb-tor1-01.ssh > cpe00fc8d403183-cm00fc8d403180.cpe.net.cable.rogers.com.62841: Flags [P.], seq 22644:22976, ack 1, win 501, options [nop,nop,TS val 1730238933 ecr 407624910], length 332
19:19:42.608775 IP ubuntu-s-1vcpu-1gb-tor1-01.ssh > cpe00fc8d403183-cm00fc8d403180.cpe.net.cable.rogers.com.62841: Flags [P.], seq 22976:23236, ack 1, win 501, options [nop,nop,TS val 1730238933 ecr 407624910], length 260
19:19:42.608871 IP ubuntu-s-1vcpu-1gb-tor1-01.ssh > cpe00fc8d403183-cm00fc8d403180.cpe.net.cable.rogers.com.62841: Flags [P.], seq 23236:23532, ack 1, win 501, options [nop,nop,TS val 1730238933 ecr 407624910], length 296
19:19:42.609023 IP ubuntu-s-1vcpu-1gb-tor1-01.ssh > cpe00fc8d403183-cm00fc8d403180.cpe.net.cable.rogers.com.62841: Flags [P.], seq 23532:23864, ack 1, win 501, options [nop,nop,TS val 1730238933 ecr 407624910], length 332
19:19:42.609326 IP cpe00fc8d403183-cm00fc8d403180.cpe.net.cable.rogers.com.62841 > ubuntu-s-1vcpu-1gb-tor1-01.ssh: Flags [.], ack 20904, win 6966, options [nop,nop,TS val 407625086 ecr 1730238832], length 0
19:19:42.609406 IP ubuntu-s-1vcpu-1gb-tor1-01.ssh > cpe00fc8d403183-cm00fc8d403180.cpe.net.cable.rogers.com.62841: Flags [P.], seq 23864:24124, ack 1, win 501, options [nop,nop,TS val 1730238933 ecr 407625086], length 260
19:19:42.609532 IP ubuntu-s-1vcpu-1gb-tor1-01.ssh > cpe00fc8d403183-cm00fc8d403180.cpe.net.cable.rogers.com.62841: Flags [P.], seq 24124:24420, ack 1, win 501, options [nop,nop,TS val 1730238934 ecr 407625086], length 296
19:19:42.609670 IP ubuntu-s-1vcpu-1gb-tor1-01.ssh > cpe00fc8d403183-cm00fc8d403180.cpe.net.cable.rogers.com.62841: Flags [P.], seq 24420:24716, ack 1, win 501, options [nop,nop,TS val 1730238934 ecr 407625086], length 296
19:19:42.609795 IP ubuntu-s-1vcpu-1gb-tor1-01.ssh > cpe00fc8d403183-cm00fc8d403180.cpe.net.cable.rogers.com.62841: Flags [P.], seq 24716:25048, ack 1, win 501, options [nop,nop,TS val 1730238934 ecr 407625086], length 332
19:19:42.609940 IP ubuntu-s-1vcpu-1gb-tor1-01.ssh > cpe00fc8d403183-cm00fc8d403180.cpe.net.cable.rogers.com.62841: Flags [P.], seq 25048:25344, ack 1, win 501, options [nop,nop,TS val 1730238934 ecr 407625086], length 296
19:19:42.610085 IP ubuntu-s-1vcpu-1gb-tor1-01.ssh > cpe00fc8d403183-cm00fc8d403180.cpe.net.cable.rogers.com.62841: Flags [P.], seq 25344:25640, ack 1, win 501, options [nop,nop,TS val 1730238934 ecr 407625086], length 296
19:19:42.610237 IP ubuntu-s-1vcpu-1gb-tor1-01.ssh > cpe00fc8d403183-cm00fc8d403180.cpe.net.cable.rogers.com.62841: Flags [P.], seq 25640:25936, ack 1, win 501, options [nop,nop,TS val 1730238934 ecr 407625086], length 296
19:19:42.610348 IP ubuntu-s-1vcpu-1gb-tor1-01.ssh > cpe00fc8d403183-cm00fc8d403180.cpe.net.cable.rogers.com.62841: Flags [P.], seq 25936:26232, ack 1, win 501, options [nop,nop,TS val 1730238934 ecr 407625086], length 296
19:19:42.610445 IP ubuntu-s-1vcpu-1gb-tor1-01.ssh > cpe00fc8d403183-cm00fc8d403180.cpe.net.cable.rogers.com.62841: Flags [P.], seq 26232:26528, ack 1, win 501, options [nop,nop,TS val 1730238934 ecr 407625086], length 296
19:19:42.610541 IP ubuntu-s-1vcpu-1gb-tor1-01.ssh > cpe00fc8d403183-cm00fc8d403180.cpe.net.cable.rogers.com.62841: Flags [P.], seq 26528:26824, ack 1, win 501, options [nop,nop,TS val 1730238935 ecr 407625086], length 296
19:19:42.610645 IP ubuntu-s-1vcpu-1gb-tor1-01.ssh > cpe00fc8d403183-cm00fc8d403180.cpe.net.cable.rogers.com.62841: Flags [P.], seq 26824:27120, ack 1, win 501, options [nop,nop,TS val 1730238935 ecr 407625086], length 296
19:19:42.610744 IP ubuntu-s-1vcpu-1gb-tor1-01.ssh > cpe00fc8d403183-cm00fc8d403180.cpe.net.cable.rogers.com.62841: Flags [P.], seq 27120:27380, ack 1, win 501, options [nop,nop,TS val 1730238935 ecr 407625086], length 260
19:19:42.610833 IP ubuntu-s-1vcpu-1gb-tor1-01.ssh > cpe00fc8d403183-cm00fc8d403180.cpe.net.cable.rogers.com.62841: Flags [P.], seq 27380:27676, ack 1, win 501, options [nop,nop,TS val 1730238935 ecr 407625086], length 296
19:19:42.610930 IP ubuntu-s-1vcpu-1gb-tor1-01.ssh > cpe00fc8d403183-cm00fc8d403180.cpe.net.cable.rogers.com.62841: Flags [P.], seq 27676:27712, ack 1, win 501, options [nop,nop,TS val 1730238935 ecr 407625086], length 36
19:19:42.610981 IP ubuntu-s-1vcpu-1gb-tor1-01.ssh > cpe00fc8d403183-cm00fc8d403180.cpe.net.cable.rogers.com.62841: Flags [P.], seq 27712:27972, ack 1, win 501, options [nop,nop,TS val 1730238935 ecr 407625086], length 260
19:19:42.611069 IP ubuntu-s-1vcpu-1gb-tor1-01.ssh > cpe00fc8d403183-cm00fc8d403180.cpe.net.cable.rogers.com.62841: Flags [P.], seq 27972:28268, ack 1, win 501, options [nop,nop,TS val 1730238935 ecr 407625086], length 296
19:19:42.611196 IP ubuntu-s-1vcpu-1gb-tor1-01.ssh > cpe00fc8d403183-cm00fc8d403180.cpe.net.cable.rogers.com.62841: Flags [P.], seq 28268:28600, ack 1, win 501, options [nop,nop,TS val 1730238935 ecr 407625086], length 332
19:19:42.611306 IP ubuntu-s-1vcpu-1gb-tor1-01.ssh > cpe00fc8d403183-cm00fc8d403180.cpe.net.cable.rogers.com.62841: Flags [P.], seq 28600:28860, ack 1, win 501, options [nop,nop,TS val 1730238935 ecr 407625086], length 260
19:19:42.611388 IP ubuntu-s-1vcpu-1gb-tor1-01.ssh > cpe00fc8d403183-cm00fc8d403180.cpe.net.cable.rogers.com.62841: Flags [P.], seq 28860:29156, ack 1, win 501, options [nop,nop,TS val 1730238935 ecr 407625086], length 296
19:19:42.611497 IP ubuntu-s-1vcpu-1gb-tor1-01.ssh > cpe00fc8d403183-cm00fc8d403180.cpe.net.cable.rogers.com.62841: Flags [P.], seq 29156:29192, ack 1, win 501, options [nop,nop,TS val 1730238935 ecr 407625086], length 36
19:19:42.611553 IP ubuntu-s-1vcpu-1gb-tor1-01.ssh > cpe00fc8d403183-cm00fc8d403180.cpe.net.cable.rogers.com.62841: Flags [P.], seq 29192:29452, ack 1, win 501, options [nop,nop,TS val 1730238936 ecr 407625086], length 260
19:19:42.611613 IP ubuntu-s-1vcpu-1gb-tor1-01.ssh > cpe00fc8d403183-cm00fc8d403180.cpe.net.cable.rogers.com.62841: Flags [P.], seq 29452:29488, ack 1, win 501, options [nop,nop,TS val 1730238936 ecr 407625086], length 36
19:19:42.611738 IP ubuntu-s-1vcpu-1gb-tor1-01.ssh > cpe00fc8d403183-cm00fc8d403180.cpe.net.cable.rogers.com.62841: Flags [P.], seq 29488:29748, ack 1, win 501, options [nop,nop,TS val 1730238936 ecr 407625086], length 260
19:19:42.611830 IP ubuntu-s-1vcpu-1gb-tor1-01.ssh > cpe00fc8d403183-cm00fc8d403180.cpe.net.cable.rogers.com.62841: Flags [P.], seq 29748:29784, ack 1, win 501, options [nop,nop,TS val 1730238936 ecr 407625086], length 36
19:19:42.611909 IP ubuntu-s-1vcpu-1gb-tor1-01.ssh > cpe00fc8d403183-cm00fc8d403180.cpe.net.cable.rogers.com.62841: Flags [P.], seq 29784:30044, ack 1, win 501, options [nop,nop,TS val 1730238936 ecr 407625086], length 260
19:19:42.612002 IP ubuntu-s-1vcpu-1gb-tor1-01.ssh > cpe00fc8d403183-cm00fc8d403180.cpe.net.cable.rogers.com.62841: Flags [P.], seq 30044:30340, ack 1, win 501, options [nop,nop,TS val 1730238936 ecr 407625086], length 296
19:19:42.612041 IP ubuntu-s-1vcpu-1gb-tor1-01.ssh > cpe00fc8d403183-cm00fc8d403180.cpe.net.cable.rogers.com.62841: Flags [P.], seq 30340:30376, ack 1, win 501, options [nop,nop,TS val 1730238936 ecr 407625086], length 36
19:19:42.612154 IP ubuntu-s-1vcpu-1gb-tor1-01.ssh > cpe00fc8d403183-cm00fc8d403180.cpe.net.cable.rogers.com.62841: Flags [P.], seq 30376:30636, ack 1, win 501, options [nop,nop,TS val 1730238936 ecr 407625086], length 260
19:19:42.612264 IP ubuntu-s-1vcpu-1gb-tor1-01.ssh > cpe00fc8d403183-cm00fc8d403180.cpe.net.cable.rogers.com.62841: Flags [P.], seq 30636:31156, ack 1, win 501, options [nop,nop,TS val 1730238936 ecr 407625086], length 520
19:19:42.612361 IP ubuntu-s-1vcpu-1gb-tor1-01.ssh > cpe00fc8d403183-cm00fc8d403180.cpe.net.cable.rogers.com.62841: Flags [P.], seq 31156:31452, ack 1, win 501, options [nop,nop,TS val 1730238936 ecr 407625086], length 296
19:19:42.612455 IP ubuntu-s-1vcpu-1gb-tor1-01.ssh > cpe00fc8d403183-cm00fc8d403180.cpe.net.cable.rogers.com.62841: Flags [P.], seq 31452:31712, ack 1, win 501, options [nop,nop,TS val 1730238936 ecr 407625086], length 260
19:19:42.612593 IP ubuntu-s-1vcpu-1gb-tor1-01.ssh > cpe00fc8d403183-cm00fc8d403180.cpe.net.cable.rogers.com.62841: Flags [P.], seq 31712:31748, ack 1, win 501, options [nop,nop,TS val 1730238937 ecr 407625086], length 36
19:19:42.612643 IP ubuntu-s-1vcpu-1gb-tor1-01.ssh > cpe00fc8d403183-cm00fc8d403180.cpe.net.cable.rogers.com.62841: Flags [P.], seq 31748:32008, ack 1, win 501, options [nop,nop,TS val 1730238937 ecr 407625086], length 260
19:19:42.612752 IP ubuntu-s-1vcpu-1gb-tor1-01.ssh > cpe00fc8d403183-cm00fc8d403180.cpe.net.cable.rogers.com.62841: Flags [P.], seq 32008:32492, ack 1, win 501, options [nop,nop,TS val 1730238937 ecr 407625086], length 484
19:19:42.612899 IP ubuntu-s-1vcpu-1gb-tor1-01.ssh > cpe00fc8d403183-cm00fc8d403180.cpe.net.cable.rogers.com.62841: Flags [P.], seq 32492:32976, ack 1, win 501, options [nop,nop,TS val 1730238937 ecr 407625086], length 484
19:19:42.613037 IP ubuntu-s-1vcpu-1gb-tor1-01.ssh > cpe00fc8d403183-cm00fc8d403180.cpe.net.cable.rogers.com.62841: Flags [P.], seq 32976:33012, ack 1, win 501, options [nop,nop,TS val 1730238937 ecr 407625086], length 36
19:19:42.617843 IP cpe00fc8d403183-cm00fc8d403180.cpe.net.cable.rogers.com.62841 > ubuntu-s-1vcpu-1gb-tor1-01.ssh: Flags [.], ack 20904, win 6966, options [nop,nop,TS val 407625086 ecr 1730238888,nop,nop,sack 1 {20868:20904}], length 0
19:19:42.626443 IP cpe00fc8d403183-cm00fc8d403180.cpe.net.cable.rogers.com.62841 > ubuntu-s-1vcpu-1gb-tor1-01.ssh: Flags [.], ack 28860, win 7002, options [nop,nop,TS val 407625102 ecr 1730238935], length 0
19:19:42.635069 IP cpe00fc8d403183-cm00fc8d403180.cpe.net.cable.rogers.com.62841 > ubuntu-s-1vcpu-1gb-tor1-01.ssh: Flags [P.], seq 1:37, ack 28860, win 7002, options [nop,nop,TS val 407625102 ecr 1730238935], length 36
19:19:42.635070 IP cpe00fc8d403183-cm00fc8d403180.cpe.net.cable.rogers.com.62841 > ubuntu-s-1vcpu-1gb-tor1-01.ssh: Flags [.], ack 33012, win 7002, options [nop,nop,TS val 407625104 ecr 1730238937], length 0
19:19:42.675601 IP ubuntu-s-1vcpu-1gb-tor1-01.ssh > cpe00fc8d403183-cm00fc8d403180.cpe.net.cable.rogers.com.62841: Flags [.], ack 37, win 501, options [nop,nop,TS val 1730239000 ecr 407625102], length 0
19:19:42.712012 IP ubuntu-s-1vcpu-1gb-tor1-01.ssh > cpe00fc8d403183-cm00fc8d403180.cpe.net.cable.rogers.com.62841: Flags [P.], seq 33012:34608, ack 37, win 501, options [nop,nop,TS val 1730239036 ecr 407625102], length 1596
19:19:42.712362 IP ubuntu-s-1vcpu-1gb-tor1-01.ssh > cpe00fc8d403183-cm00fc8d403180.cpe.net.cable.rogers.com.62841: Flags [P.], seq 34608:37504, ack 37, win 501, options [nop,nop,TS val 1730239036 ecr 407625102], length 2896
19:19:42.712473 IP ubuntu-s-1vcpu-1gb-tor1-01.ssh > cpe00fc8d403183-cm00fc8d403180.cpe.net.cable.rogers.com.62841: Flags [P.], seq 37504:37532, ack 37, win 501, options [nop,nop,TS val 1730239036 ecr 407625102], length 28
19:19:42.712565 IP ubuntu-s-1vcpu-1gb-tor1-01.ssh > cpe00fc8d403183-cm00fc8d403180.cpe.net.cable.rogers.com.62841: Flags [P.], seq 37532:38464, ack 37, win 501, options [nop,nop,TS val 1730239037 ecr 407625102], length 932
19:19:42.712717 IP ubuntu-s-1vcpu-1gb-tor1-01.ssh > cpe00fc8d403183-cm00fc8d403180.cpe.net.cable.rogers.com.62841: Flags [P.], seq 38464:38948, ack 37, win 501, options [nop,nop,TS val 1730239037 ecr 407625102], length 484
19:19:42.712826 IP ubuntu-s-1vcpu-1gb-tor1-01.ssh > cpe00fc8d403183-cm00fc8d403180.cpe.net.cable.rogers.com.62841: Flags [P.], seq 38948:39692, ack 37, win 501, options [nop,nop,TS val 1730239037 ecr 407625102], length 744
19:19:42.712926 IP ubuntu-s-1vcpu-1gb-tor1-01.ssh > cpe00fc8d403183-cm00fc8d403180.cpe.net.cable.rogers.com.62841: Flags [P.], seq 39692:40400, ack 37, win 501, options [nop,nop,TS val 1730239037 ecr 407625102], length 708
19:19:42.713046 IP ubuntu-s-1vcpu-1gb-tor1-01.ssh > cpe00fc8d403183-cm00fc8d403180.cpe.net.cable.rogers.com.62841: Flags [P.], seq 40400:41108, ack 37, win 501, options [nop,nop,TS val 1730239037 ecr 407625102], length 708
19:19:42.713329 IP ubuntu-s-1vcpu-1gb-tor1-01.ssh > cpe00fc8d403183-cm00fc8d403180.cpe.net.cable.rogers.com.62841: Flags [P.], seq 41108:41592, ack 37, win 501, options [nop,nop,TS val 1730239037 ecr 407625102], length 484
19:19:42.713448 IP ubuntu-s-1vcpu-1gb-tor1-01.ssh > cpe00fc8d403183-cm00fc8d403180.cpe.net.cable.rogers.com.62841: Flags [P.], seq 41592:41852, ack 37, win 501, options [nop,nop,TS val 1730239037 ecr 407625102], length 260
19:19:42.713553 IP ubuntu-s-1vcpu-1gb-tor1-01.ssh > cpe00fc8d403183-cm00fc8d403180.cpe.net.cable.rogers.com.62841: Flags [P.], seq 41852:41888, ack 37, win 501, options [nop,nop,TS val 1730239038 ecr 407625102], length 36
19:19:42.713637 IP ubuntu-s-1vcpu-1gb-tor1-01.ssh > cpe00fc8d403183-cm00fc8d403180.cpe.net.cable.rogers.com.62841: Flags [P.], seq 41888:42372, ack 37, win 501, options [nop,nop,TS val 1730239038 ecr 407625102], length 484
19:19:42.713752 IP ubuntu-s-1vcpu-1gb-tor1-01.ssh > cpe00fc8d403183-cm00fc8d403180.cpe.net.cable.rogers.com.62841: Flags [P.], seq 42372:42632, ack 37, win 501, options [nop,nop,TS val 1730239038 ecr 407625102], length 260
19:19:42.713879 IP ubuntu-s-1vcpu-1gb-tor1-01.ssh > cpe00fc8d403183-cm00fc8d403180.cpe.net.cable.rogers.com.62841: Flags [P.], seq 42632:43340, ack 37, win 501, options [nop,nop,TS val 1730239038 ecr 407625102], length 708
19:19:42.714065 IP ubuntu-s-1vcpu-1gb-tor1-01.ssh > cpe00fc8d403183-cm00fc8d403180.cpe.net.cable.rogers.com.62841: Flags [P.], seq 43340:44264, ack 37, win 501, options [nop,nop,TS val 1730239038 ecr 407625102], length 924
19:19:42.714218 IP ubuntu-s-1vcpu-1gb-tor1-01.ssh > cpe00fc8d403183-cm00fc8d403180.cpe.net.cable.rogers.com.62841: Flags [P.], seq 44264:44932, ack 37, win 501, options [nop,nop,TS val 1730239038 ecr 407625102], length 668
19:19:42.734376 IP cpe00fc8d403183-cm00fc8d403180.cpe.net.cable.rogers.com.62841 > ubuntu-s-1vcpu-1gb-tor1-01.ssh: Flags [.], ack 44932, win 7002, options [nop,nop,TS val 407625205 ecr 1730239038], length 0
19:19:42.815769 IP ubuntu-s-1vcpu-1gb-tor1-01.ssh > cpe00fc8d403183-cm00fc8d403180.cpe.net.cable.rogers.com.62841: Flags [P.], seq 44932:45192, ack 37, win 501, options [nop,nop,TS val 1730239140 ecr 407625205], length 260
19:19:42.815983 IP ubuntu-s-1vcpu-1gb-tor1-01.ssh > cpe00fc8d403183-cm00fc8d403180.cpe.net.cable.rogers.com.62841: Flags [P.], seq 45192:46348, ack 37, win 501, options [nop,nop,TS val 1730239140 ecr 407625205], length 1156
19:19:42.816147 IP ubuntu-s-1vcpu-1gb-tor1-01.ssh > cpe00fc8d403183-cm00fc8d403180.cpe.net.cable.rogers.com.62841: Flags [P.], seq 46348:47056, ack 37, win 501, options [nop,nop,TS val 1730239140 ecr 407625205], length 708
19:19:42.816316 IP ubuntu-s-1vcpu-1gb-tor1-01.ssh > cpe00fc8d403183-cm00fc8d403180.cpe.net.cable.rogers.com.62841: Flags [P.], seq 47056:47988, ack 37, win 501, options [nop,nop,TS val 1730239140 ecr 407625205], length 932
19:19:42.816486 IP ubuntu-s-1vcpu-1gb-tor1-01.ssh > cpe00fc8d403183-cm00fc8d403180.cpe.net.cable.rogers.com.62841: Flags [P.], seq 47988:48696, ack 37, win 501, options [nop,nop,TS val 1730239140 ecr 407625205], length 708
19:19:42.816642 IP ubuntu-s-1vcpu-1gb-tor1-01.ssh > cpe00fc8d403183-cm00fc8d403180.cpe.net.cable.rogers.com.62841: Flags [P.], seq 48696:48976, ack 37, win 501, options [nop,nop,TS val 1730239141 ecr 407625205], length 280
19:19:42.833713 IP cpe00fc8d403183-cm00fc8d403180.cpe.net.cable.rogers.com.62841 > ubuntu-s-1vcpu-1gb-tor1-01.ssh: Flags [.], ack 48976, win 7002, options [nop,nop,TS val 407625308 ecr 1730239141], length 0
19:19:42.919758 IP ubuntu-s-1vcpu-1gb-tor1-01.ssh > cpe00fc8d403183-cm00fc8d403180.cpe.net.cable.rogers.com.62841: Flags [P.], seq 48976:49236, ack 37, win 501, options [nop,nop,TS val 1730239244 ecr 407625308], length 260
19:19:42.919911 IP ubuntu-s-1vcpu-1gb-tor1-01.ssh > cpe00fc8d403183-cm00fc8d403180.cpe.net.cable.rogers.com.62841: Flags [P.], seq 49236:50176, ack 37, win 501, options [nop,nop,TS val 1730239244 ecr 407625308], length 940
19:19:42.920033 IP ubuntu-s-1vcpu-1gb-tor1-01.ssh > cpe00fc8d403183-cm00fc8d403180.cpe.net.cable.rogers.com.62841: Flags [P.], seq 50176:50644, ack 37, win 501, options [nop,nop,TS val 1730239244 ecr 407625308], length 468
19:19:42.920176 IP ubuntu-s-1vcpu-1gb-tor1-01.ssh > cpe00fc8d403183-cm00fc8d403180.cpe.net.cable.rogers.com.62841: Flags [P.], seq 50644:50680, ack 37, win 501, options [nop,nop,TS val 1730239244 ecr 407625308], length 36
19:19:42.938209 IP cpe00fc8d403183-cm00fc8d403180.cpe.net.cable.rogers.com.62841 > ubuntu-s-1vcpu-1gb-tor1-01.ssh: Flags [.], ack 50680, win 7002, options [nop,nop,TS val 407625411 ecr 1730239244], length 0
19:19:43.023786 IP ubuntu-s-1vcpu-1gb-tor1-01.ssh > cpe00fc8d403183-cm00fc8d403180.cpe.net.cable.rogers.com.62841: Flags [P.], seq 50680:50940, ack 37, win 501, options [nop,nop,TS val 1730239348 ecr 407625411], length 260
19:19:43.023915 IP ubuntu-s-1vcpu-1gb-tor1-01.ssh > cpe00fc8d403183-cm00fc8d403180.cpe.net.cable.rogers.com.62841: Flags [P.], seq 50940:51648, ack 37, win 501, options [nop,nop,TS val 1730239348 ecr 407625411], length 708
19:19:43.024122 IP ubuntu-s-1vcpu-1gb-tor1-01.ssh > cpe00fc8d403183-cm00fc8d403180.cpe.net.cable.rogers.com.62841: Flags [P.], seq 51648:51892, ack 37, win 501, options [nop,nop,TS val 1730239348 ecr 407625411], length 244
19:19:43.045545 IP cpe00fc8d403183-cm00fc8d403180.cpe.net.cable.rogers.com.62841 > ubuntu-s-1vcpu-1gb-tor1-01.ssh: Flags [.], ack 51892, win 7002, options [nop,nop,TS val 407625514 ecr 1730239348], length 0
19:19:43.127843 IP ubuntu-s-1vcpu-1gb-tor1-01.ssh > cpe00fc8d403183-cm00fc8d403180.cpe.net.cable.rogers.com.62841: Flags [P.], seq 51892:52152, ack 37, win 501, options [nop,nop,TS val 1730239452 ecr 407625514], length 260
19:19:43.128028 IP ubuntu-s-1vcpu-1gb-tor1-01.ssh > cpe00fc8d403183-cm00fc8d403180.cpe.net.cable.rogers.com.62841: Flags [P.], seq 52152:52844, ack 37, win 501, options [nop,nop,TS val 1730239452 ecr 407625514], length 692
19:19:43.144872 IP cpe00fc8d403183-cm00fc8d403180.cpe.net.cable.rogers.com.62841 > ubuntu-s-1vcpu-1gb-tor1-01.ssh: Flags [.], ack 52844, win 7002, options [nop,nop,TS val 407625619 ecr 1730239452], length 0
^C
200 packets captured
205 packets received by filter
0 packets dropped by kernel
root@ubuntu-s-1vcpu-1gb-tor1-01:~# tcpdump -i eth0 port 22
tcpdump: verbose output suppressed, use -v[v]... for full protocol decode
listening on eth0, link-type EN10MB (Ethernet), snapshot length 262144 bytes
19:20:48.680335 IP ubuntu-s-1vcpu-1gb-tor1-01.ssh > cpe00fc8d403183-cm00fc8d403180.cpe.net.cable.rogers.com.62841: Flags [P.], seq 261466203:261466311, ack 472348019, win 501, options [nop,nop,TS val 1730305004 ecr 407691083], length 108
19:20:48.680443 IP ubuntu-s-1vcpu-1gb-tor1-01.ssh > cpe00fc8d403183-cm00fc8d403180.cpe.net.cable.rogers.com.62841: Flags [P.], seq 108:264, ack 1, win 501, options [nop,nop,TS val 1730305004 ecr 407691083], length 156
19:20:48.680513 IP ubuntu-s-1vcpu-1gb-tor1-01.ssh > cpe00fc8d403183-cm00fc8d403180.cpe.net.cable.rogers.com.62841: Flags [P.], seq 264:368, ack 1, win 501, options [nop,nop,TS val 1730305005 ecr 407691083], length 104
19:20:48.687760 IP cpe00fc8d403183-cm00fc8d403180.cpe.net.cable.rogers.com.62841 > ubuntu-s-1vcpu-1gb-tor1-01.ssh: Flags [.], ack 264, win 6998, options [nop,nop,TS val 407691170 ecr 1730305004], length 0
19:20:48.696984 IP cpe00fc8d403183-cm00fc8d403180.cpe.net.cable.rogers.com.62841 > ubuntu-s-1vcpu-1gb-tor1-01.ssh: Flags [.], ack 368, win 7001, options [nop,nop,TS val 407691170 ecr 1730305005], length 0
19:20:48.783144 IP ubuntu-s-1vcpu-1gb-tor1-01.ssh > cpe00fc8d403183-cm00fc8d403180.cpe.net.cable.rogers.com.62841: Flags [P.], seq 368:644, ack 1, win 501, options [nop,nop,TS val 1730305107 ecr 407691170], length 276
19:20:48.783315 IP ubuntu-s-1vcpu-1gb-tor1-01.ssh > cpe00fc8d403183-cm00fc8d403180.cpe.net.cable.rogers.com.62841: Flags [P.], seq 644:932, ack 1, win 501, options [nop,nop,TS val 1730305107 ecr 407691170], length 288
19:20:48.783457 IP ubuntu-s-1vcpu-1gb-tor1-01.ssh > cpe00fc8d403183-cm00fc8d403180.cpe.net.cable.rogers.com.62841: Flags [P.], seq 932:968, ack 1, win 501, options [nop,nop,TS val 1730305107 ecr 407691170], length 36
19:20:48.783491 IP ubuntu-s-1vcpu-1gb-tor1-01.ssh > cpe00fc8d403183-cm00fc8d403180.cpe.net.cable.rogers.com.62841: Flags [P.], seq 968:1220, ack 1, win 501, options [nop,nop,TS val 1730305107 ecr 407691170], length 252
19:20:48.783732 IP ubuntu-s-1vcpu-1gb-tor1-01.ssh > cpe00fc8d403183-cm00fc8d403180.cpe.net.cable.rogers.com.62841: Flags [P.], seq 1220:1256, ack 1, win 501, options [nop,nop,TS val 1730305108 ecr 407691170], length 36
19:20:48.783829 IP ubuntu-s-1vcpu-1gb-tor1-01.ssh > cpe00fc8d403183-cm00fc8d403180.cpe.net.cable.rogers.com.62841: Flags [P.], seq 1256:1500, ack 1, win 501, options [nop,nop,TS val 1730305108 ecr 407691170], length 244
19:20:48.783912 IP ubuntu-s-1vcpu-1gb-tor1-01.ssh > cpe00fc8d403183-cm00fc8d403180.cpe.net.cable.rogers.com.62841: Flags [P.], seq 1500:1780, ack 1, win 501, options [nop,nop,TS val 1730305108 ecr 407691170], length 280
19:20:48.783977 IP ubuntu-s-1vcpu-1gb-tor1-01.ssh > cpe00fc8d403183-cm00fc8d403180.cpe.net.cable.rogers.com.62841: Flags [P.], seq 1780:1816, ack 1, win 501, options [nop,nop,TS val 1730305108 ecr 407691170], length 36
19:20:48.817464 IP cpe00fc8d403183-cm00fc8d403180.cpe.net.cable.rogers.com.62841 > ubuntu-s-1vcpu-1gb-tor1-01.ssh: Flags [.], ack 1816, win 6980, options [nop,nop,TS val 407691292 ecr 1730305108], length 0
19:20:48.883768 IP ubuntu-s-1vcpu-1gb-tor1-01.ssh > cpe00fc8d403183-cm00fc8d403180.cpe.net.cable.rogers.com.62841: Flags [P.], seq 1816:2068, ack 1, win 501, options [nop,nop,TS val 1730305208 ecr 407691292], length 252
19:20:48.883939 IP ubuntu-s-1vcpu-1gb-tor1-01.ssh > cpe00fc8d403183-cm00fc8d403180.cpe.net.cable.rogers.com.62841: Flags [P.], seq 2068:2356, ack 1, win 501, options [nop,nop,TS val 1730305208 ecr 407691292], length 288
19:20:48.884074 IP ubuntu-s-1vcpu-1gb-tor1-01.ssh > cpe00fc8d403183-cm00fc8d403180.cpe.net.cable.rogers.com.62841: Flags [P.], seq 2356:2392, ack 1, win 501, options [nop,nop,TS val 1730305208 ecr 407691292], length 36
19:20:48.884111 IP ubuntu-s-1vcpu-1gb-tor1-01.ssh > cpe00fc8d403183-cm00fc8d403180.cpe.net.cable.rogers.com.62841: Flags [P.], seq 2392:2644, ack 1, win 501, options [nop,nop,TS val 1730305208 ecr 407691292], length 252
19:20:48.884207 IP ubuntu-s-1vcpu-1gb-tor1-01.ssh > cpe00fc8d403183-cm00fc8d403180.cpe.net.cable.rogers.com.62841: Flags [P.], seq 2644:2680, ack 1, win 501, options [nop,nop,TS val 1730305208 ecr 407691292], length 36
19:20:48.884301 IP ubuntu-s-1vcpu-1gb-tor1-01.ssh > cpe00fc8d403183-cm00fc8d403180.cpe.net.cable.rogers.com.62841: Flags [P.], seq 2680:2968, ack 1, win 501, options [nop,nop,TS val 1730305208 ecr 407691292], length 288
19:20:48.884378 IP ubuntu-s-1vcpu-1gb-tor1-01.ssh > cpe00fc8d403183-cm00fc8d403180.cpe.net.cable.rogers.com.62841: Flags [P.], seq 2968:3256, ack 1, win 501, options [nop,nop,TS val 1730305208 ecr 407691292], length 288
19:20:48.884483 IP ubuntu-s-1vcpu-1gb-tor1-01.ssh > cpe00fc8d403183-cm00fc8d403180.cpe.net.cable.rogers.com.62841: Flags [P.], seq 3256:3552, ack 1, win 501, options [nop,nop,TS val 1730305208 ecr 407691292], length 296
19:20:48.884549 IP ubuntu-s-1vcpu-1gb-tor1-01.ssh > cpe00fc8d403183-cm00fc8d403180.cpe.net.cable.rogers.com.62841: Flags [P.], seq 3552:3812, ack 1, win 501, options [nop,nop,TS val 1730305209 ecr 407691292], length 260
19:20:48.884614 IP ubuntu-s-1vcpu-1gb-tor1-01.ssh > cpe00fc8d403183-cm00fc8d403180.cpe.net.cable.rogers.com.62841: Flags [P.], seq 3812:3848, ack 1, win 501, options [nop,nop,TS val 1730305209 ecr 407691292], length 36
19:20:48.884685 IP ubuntu-s-1vcpu-1gb-tor1-01.ssh > cpe00fc8d403183-cm00fc8d403180.cpe.net.cable.rogers.com.62841: Flags [P.], seq 3848:4100, ack 1, win 501, options [nop,nop,TS val 1730305209 ecr 407691292], length 252
19:20:48.884777 IP ubuntu-s-1vcpu-1gb-tor1-01.ssh > cpe00fc8d403183-cm00fc8d403180.cpe.net.cable.rogers.com.62841: Flags [P.], seq 4100:4136, ack 1, win 501, options [nop,nop,TS val 1730305209 ecr 407691292], length 36
19:20:48.884856 IP ubuntu-s-1vcpu-1gb-tor1-01.ssh > cpe00fc8d403183-cm00fc8d403180.cpe.net.cable.rogers.com.62841: Flags [P.], seq 4136:4380, ack 1, win 501, options [nop,nop,TS val 1730305209 ecr 407691292], length 244
19:20:48.884945 IP ubuntu-s-1vcpu-1gb-tor1-01.ssh > cpe00fc8d403183-cm00fc8d403180.cpe.net.cable.rogers.com.62841: Flags [P.], seq 4380:4416, ack 1, win 501, options [nop,nop,TS val 1730305209 ecr 407691292], length 36
19:20:48.921247 IP cpe00fc8d403183-cm00fc8d403180.cpe.net.cable.rogers.com.62841 > ubuntu-s-1vcpu-1gb-tor1-01.ssh: Flags [.], ack 4416, win 6962, options [nop,nop,TS val 407691395 ecr 1730305209], length 0
19:20:48.987988 IP ubuntu-s-1vcpu-1gb-tor1-01.ssh > cpe00fc8d403183-cm00fc8d403180.cpe.net.cable.rogers.com.62841: Flags [P.], seq 4416:4676, ack 1, win 501, options [nop,nop,TS val 1730305312 ecr 407691395], length 260
19:20:48.988163 IP ubuntu-s-1vcpu-1gb-tor1-01.ssh > cpe00fc8d403183-cm00fc8d403180.cpe.net.cable.rogers.com.62841: Flags [P.], seq 4676:4972, ack 1, win 501, options [nop,nop,TS val 1730305312 ecr 407691395], length 296
19:20:48.988319 IP ubuntu-s-1vcpu-1gb-tor1-01.ssh > cpe00fc8d403183-cm00fc8d403180.cpe.net.cable.rogers.com.62841: Flags [P.], seq 4972:5008, ack 1, win 501, options [nop,nop,TS val 1730305312 ecr 407691395], length 36
19:20:48.988373 IP ubuntu-s-1vcpu-1gb-tor1-01.ssh > cpe00fc8d403183-cm00fc8d403180.cpe.net.cable.rogers.com.62841: Flags [P.], seq 5008:5260, ack 1, win 501, options [nop,nop,TS val 1730305312 ecr 407691395], length 252
19:20:48.988471 IP ubuntu-s-1vcpu-1gb-tor1-01.ssh > cpe00fc8d403183-cm00fc8d403180.cpe.net.cable.rogers.com.62841: Flags [P.], seq 5260:5296, ack 1, win 501, options [nop,nop,TS val 1730305312 ecr 407691395], length 36
19:20:48.988589 IP ubuntu-s-1vcpu-1gb-tor1-01.ssh > cpe00fc8d403183-cm00fc8d403180.cpe.net.cable.rogers.com.62841: Flags [P.], seq 5296:5592, ack 1, win 501, options [nop,nop,TS val 1730305313 ecr 407691395], length 296
19:20:48.988686 IP ubuntu-s-1vcpu-1gb-tor1-01.ssh > cpe00fc8d403183-cm00fc8d403180.cpe.net.cable.rogers.com.62841: Flags [P.], seq 5592:6140, ack 1, win 501, options [nop,nop,TS val 1730305313 ecr 407691395], length 548
19:20:48.988758 IP ubuntu-s-1vcpu-1gb-tor1-01.ssh > cpe00fc8d403183-cm00fc8d403180.cpe.net.cable.rogers.com.62841: Flags [P.], seq 6140:6176, ack 1, win 501, options [nop,nop,TS val 1730305313 ecr 407691395], length 36
19:20:48.988831 IP ubuntu-s-1vcpu-1gb-tor1-01.ssh > cpe00fc8d403183-cm00fc8d403180.cpe.net.cable.rogers.com.62841: Flags [P.], seq 6176:6472, ack 1, win 501, options [nop,nop,TS val 1730305313 ecr 407691395], length 296
19:20:48.988903 IP ubuntu-s-1vcpu-1gb-tor1-01.ssh > cpe00fc8d403183-cm00fc8d403180.cpe.net.cable.rogers.com.62841: Flags [P.], seq 6472:6768, ack 1, win 501, options [nop,nop,TS val 1730305313 ecr 407691395], length 296
19:20:48.989007 IP ubuntu-s-1vcpu-1gb-tor1-01.ssh > cpe00fc8d403183-cm00fc8d403180.cpe.net.cable.rogers.com.62841: Flags [P.], seq 6768:7352, ack 1, win 501, options [nop,nop,TS val 1730305313 ecr 407691395], length 584
19:20:48.989312 IP ubuntu-s-1vcpu-1gb-tor1-01.ssh > cpe00fc8d403183-cm00fc8d403180.cpe.net.cable.rogers.com.62841: Flags [P.], seq 7352:8232, ack 1, win 501, options [nop,nop,TS val 1730305313 ecr 407691395], length 880
19:20:48.989428 IP ubuntu-s-1vcpu-1gb-tor1-01.ssh > cpe00fc8d403183-cm00fc8d403180.cpe.net.cable.rogers.com.62841: Flags [P.], seq 8232:8800, ack 1, win 501, options [nop,nop,TS val 1730305313 ecr 407691395], length 568
19:20:49.007677 IP cpe00fc8d403183-cm00fc8d403180.cpe.net.cable.rogers.com.62841 > ubuntu-s-1vcpu-1gb-tor1-01.ssh: Flags [.], ack 8800, win 7002, options [nop,nop,TS val 407691484 ecr 1730305313], length 0
19:20:49.091774 IP ubuntu-s-1vcpu-1gb-tor1-01.ssh > cpe00fc8d403183-cm00fc8d403180.cpe.net.cable.rogers.com.62841: Flags [P.], seq 8800:9060, ack 1, win 501, options [nop,nop,TS val 1730305416 ecr 407691484], length 260
19:20:49.091933 IP ubuntu-s-1vcpu-1gb-tor1-01.ssh > cpe00fc8d403183-cm00fc8d403180.cpe.net.cable.rogers.com.62841: Flags [P.], seq 9060:9356, ack 1, win 501, options [nop,nop,TS val 1730305416 ecr 407691484], length 296
19:20:49.092077 IP ubuntu-s-1vcpu-1gb-tor1-01.ssh > cpe00fc8d403183-cm00fc8d403180.cpe.net.cable.rogers.com.62841: Flags [P.], seq 9356:9644, ack 1, win 501, options [nop,nop,TS val 1730305416 ecr 407691484], length 288
19:20:49.092189 IP ubuntu-s-1vcpu-1gb-tor1-01.ssh > cpe00fc8d403183-cm00fc8d403180.cpe.net.cable.rogers.com.62841: Flags [P.], seq 9644:9940, ack 1, win 501, options [nop,nop,TS val 1730305416 ecr 407691484], length 296
19:20:49.092337 IP ubuntu-s-1vcpu-1gb-tor1-01.ssh > cpe00fc8d403183-cm00fc8d403180.cpe.net.cable.rogers.com.62841: Flags [P.], seq 9940:10228, ack 1, win 501, options [nop,nop,TS val 1730305416 ecr 407691484], length 288
19:20:49.092434 IP ubuntu-s-1vcpu-1gb-tor1-01.ssh > cpe00fc8d403183-cm00fc8d403180.cpe.net.cable.rogers.com.62841: Flags [P.], seq 10228:10524, ack 1, win 501, options [nop,nop,TS val 1730305416 ecr 407691484], length 296
19:20:49.092500 IP ubuntu-s-1vcpu-1gb-tor1-01.ssh > cpe00fc8d403183-cm00fc8d403180.cpe.net.cable.rogers.com.62841: Flags [P.], seq 10524:10560, ack 1, win 501, options [nop,nop,TS val 1730305416 ecr 407691484], length 36
19:20:49.092619 IP ubuntu-s-1vcpu-1gb-tor1-01.ssh > cpe00fc8d403183-cm00fc8d403180.cpe.net.cable.rogers.com.62841: Flags [P.], seq 10560:10856, ack 1, win 501, options [nop,nop,TS val 1730305417 ecr 407691484], length 296
19:20:49.092728 IP ubuntu-s-1vcpu-1gb-tor1-01.ssh > cpe00fc8d403183-cm00fc8d403180.cpe.net.cable.rogers.com.62841: Flags [P.], seq 10856:11108, ack 1, win 501, options [nop,nop,TS val 1730305417 ecr 407691484], length 252
19:20:49.092842 IP ubuntu-s-1vcpu-1gb-tor1-01.ssh > cpe00fc8d403183-cm00fc8d403180.cpe.net.cable.rogers.com.62841: Flags [P.], seq 11108:11404, ack 1, win 501, options [nop,nop,TS val 1730305417 ecr 407691484], length 296
19:20:49.092972 IP ubuntu-s-1vcpu-1gb-tor1-01.ssh > cpe00fc8d403183-cm00fc8d403180.cpe.net.cable.rogers.com.62841: Flags [P.], seq 11404:11700, ack 1, win 501, options [nop,nop,TS val 1730305417 ecr 407691484], length 296
19:20:49.093061 IP ubuntu-s-1vcpu-1gb-tor1-01.ssh > cpe00fc8d403183-cm00fc8d403180.cpe.net.cable.rogers.com.62841: Flags [P.], seq 11700:11736, ack 1, win 501, options [nop,nop,TS val 1730305417 ecr 407691484], length 36
19:20:49.093266 IP ubuntu-s-1vcpu-1gb-tor1-01.ssh > cpe00fc8d403183-cm00fc8d403180.cpe.net.cable.rogers.com.62841: Flags [P.], seq 11736:12032, ack 1, win 501, options [nop,nop,TS val 1730305417 ecr 407691484], length 296
19:20:49.093384 IP ubuntu-s-1vcpu-1gb-tor1-01.ssh > cpe00fc8d403183-cm00fc8d403180.cpe.net.cable.rogers.com.62841: Flags [P.], seq 12032:12328, ack 1, win 501, options [nop,nop,TS val 1730305417 ecr 407691484], length 296
19:20:49.093503 IP ubuntu-s-1vcpu-1gb-tor1-01.ssh > cpe00fc8d403183-cm00fc8d403180.cpe.net.cable.rogers.com.62841: Flags [P.], seq 12328:12588, ack 1, win 501, options [nop,nop,TS val 1730305417 ecr 407691484], length 260
19:20:49.093620 IP ubuntu-s-1vcpu-1gb-tor1-01.ssh > cpe00fc8d403183-cm00fc8d403180.cpe.net.cable.rogers.com.62841: Flags [P.], seq 12588:12868, ack 1, win 501, options [nop,nop,TS val 1730305418 ecr 407691484], length 280
19:20:49.093745 IP ubuntu-s-1vcpu-1gb-tor1-01.ssh > cpe00fc8d403183-cm00fc8d403180.cpe.net.cable.rogers.com.62841: Flags [P.], seq 12868:12904, ack 1, win 501, options [nop,nop,TS val 1730305418 ecr 407691484], length 36
19:20:49.151584 IP ubuntu-s-1vcpu-1gb-tor1-01.ssh > cpe00fc8d403183-cm00fc8d403180.cpe.net.cable.rogers.com.62841: Flags [P.], seq 12868:12904, ack 1, win 501, options [nop,nop,TS val 1730305476 ecr 407691484], length 36
19:20:49.193324 IP cpe00fc8d403183-cm00fc8d403180.cpe.net.cable.rogers.com.62841 > ubuntu-s-1vcpu-1gb-tor1-01.ssh: Flags [.], ack 12904, win 7002, options [nop,nop,TS val 407691671 ecr 1730305476], length 0
19:20:49.195814 IP ubuntu-s-1vcpu-1gb-tor1-01.ssh > cpe00fc8d403183-cm00fc8d403180.cpe.net.cable.rogers.com.62841: Flags [P.], seq 12904:13164, ack 1, win 501, options [nop,nop,TS val 1730305520 ecr 407691671], length 260
19:20:49.195923 IP ubuntu-s-1vcpu-1gb-tor1-01.ssh > cpe00fc8d403183-cm00fc8d403180.cpe.net.cable.rogers.com.62841: Flags [P.], seq 13164:13460, ack 1, win 501, options [nop,nop,TS val 1730305520 ecr 407691671], length 296
19:20:49.195979 IP ubuntu-s-1vcpu-1gb-tor1-01.ssh > cpe00fc8d403183-cm00fc8d403180.cpe.net.cable.rogers.com.62841: Flags [P.], seq 13460:13496, ack 1, win 501, options [nop,nop,TS val 1730305520 ecr 407691671], length 36
19:20:49.196076 IP ubuntu-s-1vcpu-1gb-tor1-01.ssh > cpe00fc8d403183-cm00fc8d403180.cpe.net.cable.rogers.com.62841: Flags [P.], seq 13496:13792, ack 1, win 501, options [nop,nop,TS val 1730305520 ecr 407691671], length 296
19:20:49.196180 IP ubuntu-s-1vcpu-1gb-tor1-01.ssh > cpe00fc8d403183-cm00fc8d403180.cpe.net.cable.rogers.com.62841: Flags [P.], seq 13792:14088, ack 1, win 501, options [nop,nop,TS val 1730305520 ecr 407691671], length 296
19:20:49.196324 IP ubuntu-s-1vcpu-1gb-tor1-01.ssh > cpe00fc8d403183-cm00fc8d403180.cpe.net.cable.rogers.com.62841: Flags [P.], seq 14088:14644, ack 1, win 501, options [nop,nop,TS val 1730305520 ecr 407691671], length 556
19:20:49.196434 IP ubuntu-s-1vcpu-1gb-tor1-01.ssh > cpe00fc8d403183-cm00fc8d403180.cpe.net.cable.rogers.com.62841: Flags [P.], seq 14644:14976, ack 1, win 501, options [nop,nop,TS val 1730305520 ecr 407691671], length 332
19:20:49.196527 IP ubuntu-s-1vcpu-1gb-tor1-01.ssh > cpe00fc8d403183-cm00fc8d403180.cpe.net.cable.rogers.com.62841: Flags [P.], seq 14976:15272, ack 1, win 501, options [nop,nop,TS val 1730305521 ecr 407691671], length 296
19:20:49.196620 IP ubuntu-s-1vcpu-1gb-tor1-01.ssh > cpe00fc8d403183-cm00fc8d403180.cpe.net.cable.rogers.com.62841: Flags [P.], seq 15272:15568, ack 1, win 501, options [nop,nop,TS val 1730305521 ecr 407691671], length 296
19:20:49.196707 IP ubuntu-s-1vcpu-1gb-tor1-01.ssh > cpe00fc8d403183-cm00fc8d403180.cpe.net.cable.rogers.com.62841: Flags [P.], seq 15568:16124, ack 1, win 501, options [nop,nop,TS val 1730305521 ecr 407691671], length 556
19:20:49.196800 IP ubuntu-s-1vcpu-1gb-tor1-01.ssh > cpe00fc8d403183-cm00fc8d403180.cpe.net.cable.rogers.com.62841: Flags [P.], seq 16124:16420, ack 1, win 501, options [nop,nop,TS val 1730305521 ecr 407691671], length 296
19:20:49.196896 IP ubuntu-s-1vcpu-1gb-tor1-01.ssh > cpe00fc8d403183-cm00fc8d403180.cpe.net.cable.rogers.com.62841: Flags [P.], seq 16420:16456, ack 1, win 501, options [nop,nop,TS val 1730305521 ecr 407691671], length 36
19:20:49.196917 IP ubuntu-s-1vcpu-1gb-tor1-01.ssh > cpe00fc8d403183-cm00fc8d403180.cpe.net.cable.rogers.com.62841: Flags [P.], seq 16456:16716, ack 1, win 501, options [nop,nop,TS val 1730305521 ecr 407691671], length 260
19:20:49.196991 IP ubuntu-s-1vcpu-1gb-tor1-01.ssh > cpe00fc8d403183-cm00fc8d403180.cpe.net.cable.rogers.com.62841: Flags [P.], seq 16716:16752, ack 1, win 501, options [nop,nop,TS val 1730305521 ecr 407691671], length 36
19:20:49.197066 IP ubuntu-s-1vcpu-1gb-tor1-01.ssh > cpe00fc8d403183-cm00fc8d403180.cpe.net.cable.rogers.com.62841: Flags [P.], seq 16752:17012, ack 1, win 501, options [nop,nop,TS val 1730305521 ecr 407691671], length 260
19:20:49.197228 IP ubuntu-s-1vcpu-1gb-tor1-01.ssh > cpe00fc8d403183-cm00fc8d403180.cpe.net.cable.rogers.com.62841: Flags [P.], seq 17012:17048, ack 1, win 501, options [nop,nop,TS val 1730305521 ecr 407691671], length 36
19:20:49.197319 IP ubuntu-s-1vcpu-1gb-tor1-01.ssh > cpe00fc8d403183-cm00fc8d403180.cpe.net.cable.rogers.com.62841: Flags [P.], seq 17048:17308, ack 1, win 501, options [nop,nop,TS val 1730305521 ecr 407691671], length 260
19:20:49.197389 IP ubuntu-s-1vcpu-1gb-tor1-01.ssh > cpe00fc8d403183-cm00fc8d403180.cpe.net.cable.rogers.com.62841: Flags [P.], seq 17308:17344, ack 1, win 501, options [nop,nop,TS val 1730305521 ecr 407691671], length 36
19:20:49.197471 IP ubuntu-s-1vcpu-1gb-tor1-01.ssh > cpe00fc8d403183-cm00fc8d403180.cpe.net.cable.rogers.com.62841: Flags [P.], seq 17344:17604, ack 1, win 501, options [nop,nop,TS val 1730305521 ecr 407691671], length 260
19:20:49.197543 IP ubuntu-s-1vcpu-1gb-tor1-01.ssh > cpe00fc8d403183-cm00fc8d403180.cpe.net.cable.rogers.com.62841: Flags [P.], seq 17604:17900, ack 1, win 501, options [nop,nop,TS val 1730305522 ecr 407691671], length 296
19:20:49.197616 IP ubuntu-s-1vcpu-1gb-tor1-01.ssh > cpe00fc8d403183-cm00fc8d403180.cpe.net.cable.rogers.com.62841: Flags [P.], seq 17900:18196, ack 1, win 501, options [nop,nop,TS val 1730305522 ecr 407691671], length 296
19:20:49.197688 IP ubuntu-s-1vcpu-1gb-tor1-01.ssh > cpe00fc8d403183-cm00fc8d403180.cpe.net.cable.rogers.com.62841: Flags [P.], seq 18196:18232, ack 1, win 501, options [nop,nop,TS val 1730305522 ecr 407691671], length 36
19:20:49.197777 IP ubuntu-s-1vcpu-1gb-tor1-01.ssh > cpe00fc8d403183-cm00fc8d403180.cpe.net.cable.rogers.com.62841: Flags [P.], seq 18232:18512, ack 1, win 501, options [nop,nop,TS val 1730305522 ecr 407691671], length 280
19:20:49.219216 IP cpe00fc8d403183-cm00fc8d403180.cpe.net.cable.rogers.com.62841 > ubuntu-s-1vcpu-1gb-tor1-01.ssh: Flags [.], ack 17048, win 6942, options [nop,nop,TS val 407691688 ecr 1730305521], length 0
19:20:49.219217 IP cpe00fc8d403183-cm00fc8d403180.cpe.net.cable.rogers.com.62841 > ubuntu-s-1vcpu-1gb-tor1-01.ssh: Flags [.], ack 18512, win 6980, options [nop,nop,TS val 407691688 ecr 1730305522], length 0
19:20:49.299736 IP ubuntu-s-1vcpu-1gb-tor1-01.ssh > cpe00fc8d403183-cm00fc8d403180.cpe.net.cable.rogers.com.62841: Flags [P.], seq 18512:18772, ack 1, win 501, options [nop,nop,TS val 1730305624 ecr 407691688], length 260
19:20:49.299848 IP ubuntu-s-1vcpu-1gb-tor1-01.ssh > cpe00fc8d403183-cm00fc8d403180.cpe.net.cable.rogers.com.62841: Flags [P.], seq 18772:19068, ack 1, win 501, options [nop,nop,TS val 1730305624 ecr 407691688], length 296
19:20:49.299918 IP ubuntu-s-1vcpu-1gb-tor1-01.ssh > cpe00fc8d403183-cm00fc8d403180.cpe.net.cable.rogers.com.62841: Flags [P.], seq 19068:19104, ack 1, win 501, options [nop,nop,TS val 1730305624 ecr 407691688], length 36
19:20:49.300003 IP ubuntu-s-1vcpu-1gb-tor1-01.ssh > cpe00fc8d403183-cm00fc8d403180.cpe.net.cable.rogers.com.62841: Flags [P.], seq 19104:19364, ack 1, win 501, options [nop,nop,TS val 1730305624 ecr 407691688], length 260
19:20:49.300084 IP ubuntu-s-1vcpu-1gb-tor1-01.ssh > cpe00fc8d403183-cm00fc8d403180.cpe.net.cable.rogers.com.62841: Flags [P.], seq 19364:19400, ack 1, win 501, options [nop,nop,TS val 1730305624 ecr 407691688], length 36
19:20:49.300187 IP ubuntu-s-1vcpu-1gb-tor1-01.ssh > cpe00fc8d403183-cm00fc8d403180.cpe.net.cable.rogers.com.62841: Flags [P.], seq 19400:19660, ack 1, win 501, options [nop,nop,TS val 1730305624 ecr 407691688], length 260
19:20:49.300255 IP ubuntu-s-1vcpu-1gb-tor1-01.ssh > cpe00fc8d403183-cm00fc8d403180.cpe.net.cable.rogers.com.62841: Flags [P.], seq 19660:19696, ack 1, win 501, options [nop,nop,TS val 1730305624 ecr 407691688], length 36
19:20:49.300326 IP ubuntu-s-1vcpu-1gb-tor1-01.ssh > cpe00fc8d403183-cm00fc8d403180.cpe.net.cable.rogers.com.62841: Flags [P.], seq 19696:19956, ack 1, win 501, options [nop,nop,TS val 1730305624 ecr 407691688], length 260
19:20:49.300399 IP ubuntu-s-1vcpu-1gb-tor1-01.ssh > cpe00fc8d403183-cm00fc8d403180.cpe.net.cable.rogers.com.62841: Flags [P.], seq 19956:19992, ack 1, win 501, options [nop,nop,TS val 1730305624 ecr 407691688], length 36
19:20:49.300471 IP ubuntu-s-1vcpu-1gb-tor1-01.ssh > cpe00fc8d403183-cm00fc8d403180.cpe.net.cable.rogers.com.62841: Flags [P.], seq 19992:20288, ack 1, win 501, options [nop,nop,TS val 1730305624 ecr 407691688], length 296
19:20:49.300544 IP ubuntu-s-1vcpu-1gb-tor1-01.ssh > cpe00fc8d403183-cm00fc8d403180.cpe.net.cable.rogers.com.62841: Flags [P.], seq 20288:20584, ack 1, win 501, options [nop,nop,TS val 1730305625 ecr 407691688], length 296
19:20:49.300615 IP ubuntu-s-1vcpu-1gb-tor1-01.ssh > cpe00fc8d403183-cm00fc8d403180.cpe.net.cable.rogers.com.62841: Flags [P.], seq 20584:20880, ack 1, win 501, options [nop,nop,TS val 1730305625 ecr 407691688], length 296
19:20:49.300725 IP ubuntu-s-1vcpu-1gb-tor1-01.ssh > cpe00fc8d403183-cm00fc8d403180.cpe.net.cable.rogers.com.62841: Flags [P.], seq 20880:21176, ack 1, win 501, options [nop,nop,TS val 1730305625 ecr 407691688], length 296
19:20:49.300841 IP ubuntu-s-1vcpu-1gb-tor1-01.ssh > cpe00fc8d403183-cm00fc8d403180.cpe.net.cable.rogers.com.62841: Flags [P.], seq 21176:21472, ack 1, win 501, options [nop,nop,TS val 1730305625 ecr 407691688], length 296
19:20:49.301012 IP ubuntu-s-1vcpu-1gb-tor1-01.ssh > cpe00fc8d403183-cm00fc8d403180.cpe.net.cable.rogers.com.62841: Flags [P.], seq 21472:21768, ack 1, win 501, options [nop,nop,TS val 1730305625 ecr 407691688], length 296
19:20:49.301207 IP ubuntu-s-1vcpu-1gb-tor1-01.ssh > cpe00fc8d403183-cm00fc8d403180.cpe.net.cable.rogers.com.62841: Flags [P.], seq 21768:22064, ack 1, win 501, options [nop,nop,TS val 1730305625 ecr 407691688], length 296
19:20:49.301305 IP ubuntu-s-1vcpu-1gb-tor1-01.ssh > cpe00fc8d403183-cm00fc8d403180.cpe.net.cable.rogers.com.62841: Flags [P.], seq 22064:22620, ack 1, win 501, options [nop,nop,TS val 1730305625 ecr 407691688], length 556
19:20:49.301426 IP ubuntu-s-1vcpu-1gb-tor1-01.ssh > cpe00fc8d403183-cm00fc8d403180.cpe.net.cable.rogers.com.62841: Flags [P.], seq 22620:22952, ack 1, win 501, options [nop,nop,TS val 1730305625 ecr 407691688], length 332
19:20:49.301521 IP ubuntu-s-1vcpu-1gb-tor1-01.ssh > cpe00fc8d403183-cm00fc8d403180.cpe.net.cable.rogers.com.62841: Flags [P.], seq 22952:23508, ack 1, win 501, options [nop,nop,TS val 1730305626 ecr 407691688], length 556
19:20:49.301647 IP ubuntu-s-1vcpu-1gb-tor1-01.ssh > cpe00fc8d403183-cm00fc8d403180.cpe.net.cable.rogers.com.62841: Flags [P.], seq 23508:23804, ack 1, win 501, options [nop,nop,TS val 1730305626 ecr 407691688], length 296
19:20:49.301742 IP ubuntu-s-1vcpu-1gb-tor1-01.ssh > cpe00fc8d403183-cm00fc8d403180.cpe.net.cable.rogers.com.62841: Flags [P.], seq 23804:24136, ack 1, win 501, options [nop,nop,TS val 1730305626 ecr 407691688], length 332
19:20:49.301871 IP ubuntu-s-1vcpu-1gb-tor1-01.ssh > cpe00fc8d403183-cm00fc8d403180.cpe.net.cable.rogers.com.62841: Flags [P.], seq 24136:24692, ack 1, win 501, options [nop,nop,TS val 1730305626 ecr 407691688], length 556
19:20:49.301975 IP ubuntu-s-1vcpu-1gb-tor1-01.ssh > cpe00fc8d403183-cm00fc8d403180.cpe.net.cable.rogers.com.62841: Flags [P.], seq 24692:24728, ack 1, win 501, options [nop,nop,TS val 1730305626 ecr 407691688], length 36
19:20:49.302081 IP ubuntu-s-1vcpu-1gb-tor1-01.ssh > cpe00fc8d403183-cm00fc8d403180.cpe.net.cable.rogers.com.62841: Flags [P.], seq 24728:25024, ack 1, win 501, options [nop,nop,TS val 1730305626 ecr 407691688], length 296
19:20:49.302171 IP ubuntu-s-1vcpu-1gb-tor1-01.ssh > cpe00fc8d403183-cm00fc8d403180.cpe.net.cable.rogers.com.62841: Flags [P.], seq 25024:25320, ack 1, win 501, options [nop,nop,TS val 1730305626 ecr 407691688], length 296
19:20:49.302246 IP ubuntu-s-1vcpu-1gb-tor1-01.ssh > cpe00fc8d403183-cm00fc8d403180.cpe.net.cable.rogers.com.62841: Flags [P.], seq 25320:25564, ack 1, win 501, options [nop,nop,TS val 1730305626 ecr 407691688], length 244
19:20:49.302319 IP ubuntu-s-1vcpu-1gb-tor1-01.ssh > cpe00fc8d403183-cm00fc8d403180.cpe.net.cable.rogers.com.62841: Flags [P.], seq 25564:25844, ack 1, win 501, options [nop,nop,TS val 1730305626 ecr 407691688], length 280
19:20:49.302395 IP ubuntu-s-1vcpu-1gb-tor1-01.ssh > cpe00fc8d403183-cm00fc8d403180.cpe.net.cable.rogers.com.62841: Flags [P.], seq 25844:25880, ack 1, win 501, options [nop,nop,TS val 1730305626 ecr 407691688], length 36
19:20:49.310241 IP cpe00fc8d403183-cm00fc8d403180.cpe.net.cable.rogers.com.62841 > ubuntu-s-1vcpu-1gb-tor1-01.ssh: Flags [.], ack 21768, win 6965, options [nop,nop,TS val 407691792 ecr 1730305625], length 0
19:20:49.310242 IP cpe00fc8d403183-cm00fc8d403180.cpe.net.cable.rogers.com.62841 > ubuntu-s-1vcpu-1gb-tor1-01.ssh: Flags [.], ack 25880, win 7002, options [nop,nop,TS val 407691793 ecr 1730305626], length 0
19:20:49.403851 IP ubuntu-s-1vcpu-1gb-tor1-01.ssh > cpe00fc8d403183-cm00fc8d403180.cpe.net.cable.rogers.com.62841: Flags [P.], seq 25880:26140, ack 1, win 501, options [nop,nop,TS val 1730305728 ecr 407691793], length 260
19:20:49.404010 IP ubuntu-s-1vcpu-1gb-tor1-01.ssh > cpe00fc8d403183-cm00fc8d403180.cpe.net.cable.rogers.com.62841: Flags [P.], seq 26140:26176, ack 1, win 501, options [nop,nop,TS val 1730305728 ecr 407691793], length 36
19:20:49.404059 IP ubuntu-s-1vcpu-1gb-tor1-01.ssh > cpe00fc8d403183-cm00fc8d403180.cpe.net.cable.rogers.com.62841: Flags [P.], seq 26176:26436, ack 1, win 501, options [nop,nop,TS val 1730305728 ecr 407691793], length 260
19:20:49.404156 IP ubuntu-s-1vcpu-1gb-tor1-01.ssh > cpe00fc8d403183-cm00fc8d403180.cpe.net.cable.rogers.com.62841: Flags [P.], seq 26436:26472, ack 1, win 501, options [nop,nop,TS val 1730305728 ecr 407691793], length 36
19:20:49.404249 IP ubuntu-s-1vcpu-1gb-tor1-01.ssh > cpe00fc8d403183-cm00fc8d403180.cpe.net.cable.rogers.com.62841: Flags [P.], seq 26472:26732, ack 1, win 501, options [nop,nop,TS val 1730305728 ecr 407691793], length 260
19:20:49.404327 IP ubuntu-s-1vcpu-1gb-tor1-01.ssh > cpe00fc8d403183-cm00fc8d403180.cpe.net.cable.rogers.com.62841: Flags [P.], seq 26732:26768, ack 1, win 501, options [nop,nop,TS val 1730305728 ecr 407691793], length 36
19:20:49.404399 IP ubuntu-s-1vcpu-1gb-tor1-01.ssh > cpe00fc8d403183-cm00fc8d403180.cpe.net.cable.rogers.com.62841: Flags [P.], seq 26768:27064, ack 1, win 501, options [nop,nop,TS val 1730305728 ecr 407691793], length 296
19:20:49.404469 IP ubuntu-s-1vcpu-1gb-tor1-01.ssh > cpe00fc8d403183-cm00fc8d403180.cpe.net.cable.rogers.com.62841: Flags [P.], seq 27064:27324, ack 1, win 501, options [nop,nop,TS val 1730305728 ecr 407691793], length 260
19:20:49.404540 IP ubuntu-s-1vcpu-1gb-tor1-01.ssh > cpe00fc8d403183-cm00fc8d403180.cpe.net.cable.rogers.com.62841: Flags [P.], seq 27324:27360, ack 1, win 501, options [nop,nop,TS val 1730305729 ecr 407691793], length 36
19:20:49.404612 IP ubuntu-s-1vcpu-1gb-tor1-01.ssh > cpe00fc8d403183-cm00fc8d403180.cpe.net.cable.rogers.com.62841: Flags [P.], seq 27360:27656, ack 1, win 501, options [nop,nop,TS val 1730305729 ecr 407691793], length 296
19:20:49.404684 IP ubuntu-s-1vcpu-1gb-tor1-01.ssh > cpe00fc8d403183-cm00fc8d403180.cpe.net.cable.rogers.com.62841: Flags [P.], seq 27656:27916, ack 1, win 501, options [nop,nop,TS val 1730305729 ecr 407691793], length 260
19:20:49.404756 IP ubuntu-s-1vcpu-1gb-tor1-01.ssh > cpe00fc8d403183-cm00fc8d403180.cpe.net.cable.rogers.com.62841: Flags [P.], seq 27916:27952, ack 1, win 501, options [nop,nop,TS val 1730305729 ecr 407691793], length 36
19:20:49.404837 IP ubuntu-s-1vcpu-1gb-tor1-01.ssh > cpe00fc8d403183-cm00fc8d403180.cpe.net.cable.rogers.com.62841: Flags [P.], seq 27952:28248, ack 1, win 501, options [nop,nop,TS val 1730305729 ecr 407691793], length 296
19:20:49.404981 IP ubuntu-s-1vcpu-1gb-tor1-01.ssh > cpe00fc8d403183-cm00fc8d403180.cpe.net.cable.rogers.com.62841: Flags [P.], seq 28248:28544, ack 1, win 501, options [nop,nop,TS val 1730305729 ecr 407691793], length 296
19:20:49.405183 IP ubuntu-s-1vcpu-1gb-tor1-01.ssh > cpe00fc8d403183-cm00fc8d403180.cpe.net.cable.rogers.com.62841: Flags [P.], seq 28544:28840, ack 1, win 501, options [nop,nop,TS val 1730305729 ecr 407691793], length 296
19:20:49.405318 IP ubuntu-s-1vcpu-1gb-tor1-01.ssh > cpe00fc8d403183-cm00fc8d403180.cpe.net.cable.rogers.com.62841: Flags [P.], seq 28840:29396, ack 1, win 501, options [nop,nop,TS val 1730305729 ecr 407691793], length 556
19:20:49.405447 IP ubuntu-s-1vcpu-1gb-tor1-01.ssh > cpe00fc8d403183-cm00fc8d403180.cpe.net.cable.rogers.com.62841: Flags [P.], seq 29396:29692, ack 1, win 501, options [nop,nop,TS val 1730305729 ecr 407691793], length 296
19:20:49.405549 IP ubuntu-s-1vcpu-1gb-tor1-01.ssh > cpe00fc8d403183-cm00fc8d403180.cpe.net.cable.rogers.com.62841: Flags [P.], seq 29692:29952, ack 1, win 501, options [nop,nop,TS val 1730305730 ecr 407691793], length 260
19:20:49.405655 IP ubuntu-s-1vcpu-1gb-tor1-01.ssh > cpe00fc8d403183-cm00fc8d403180.cpe.net.cable.rogers.com.62841: Flags [P.], seq 29952:30660, ack 1, win 501, options [nop,nop,TS val 1730305730 ecr 407691793], length 708
19:20:49.405813 IP ubuntu-s-1vcpu-1gb-tor1-01.ssh > cpe00fc8d403183-cm00fc8d403180.cpe.net.cable.rogers.com.62841: Flags [P.], seq 30660:31368, ack 1, win 501, options [nop,nop,TS val 1730305730 ecr 407691793], length 708
19:20:49.405952 IP ubuntu-s-1vcpu-1gb-tor1-01.ssh > cpe00fc8d403183-cm00fc8d403180.cpe.net.cable.rogers.com.62841: Flags [P.], seq 31368:32300, ack 1, win 501, options [nop,nop,TS val 1730305730 ecr 407691793], length 932
19:20:49.406077 IP ubuntu-s-1vcpu-1gb-tor1-01.ssh > cpe00fc8d403183-cm00fc8d403180.cpe.net.cable.rogers.com.62841: Flags [P.], seq 32300:32560, ack 1, win 501, options [nop,nop,TS val 1730305730 ecr 407691793], length 260
19:20:49.406201 IP ubuntu-s-1vcpu-1gb-tor1-01.ssh > cpe00fc8d403183-cm00fc8d403180.cpe.net.cable.rogers.com.62841: Flags [P.], seq 32560:33268, ack 1, win 501, options [nop,nop,TS val 1730305730 ecr 407691793], length 708
19:20:49.406311 IP ubuntu-s-1vcpu-1gb-tor1-01.ssh > cpe00fc8d403183-cm00fc8d403180.cpe.net.cable.rogers.com.62841: Flags [P.], seq 33268:33720, ack 1, win 501, options [nop,nop,TS val 1730305730 ecr 407691793], length 452
19:20:49.418003 IP cpe00fc8d403183-cm00fc8d403180.cpe.net.cable.rogers.com.62841 > ubuntu-s-1vcpu-1gb-tor1-01.ssh: Flags [.], ack 29952, win 7002, options [nop,nop,TS val 407691896 ecr 1730305730], length 0
19:20:49.426651 IP cpe00fc8d403183-cm00fc8d403180.cpe.net.cable.rogers.com.62841 > ubuntu-s-1vcpu-1gb-tor1-01.ssh: Flags [.], ack 33720, win 7002, options [nop,nop,TS val 407691896 ecr 1730305730], length 0
19:20:49.507875 IP ubuntu-s-1vcpu-1gb-tor1-01.ssh > cpe00fc8d403183-cm00fc8d403180.cpe.net.cable.rogers.com.62841: Flags [P.], seq 33720:33980, ack 1, win 501, options [nop,nop,TS val 1730305832 ecr 407691896], length 260
19:20:49.508105 IP ubuntu-s-1vcpu-1gb-tor1-01.ssh > cpe00fc8d403183-cm00fc8d403180.cpe.net.cable.rogers.com.62841: Flags [P.], seq 33980:34464, ack 1, win 501, options [nop,nop,TS val 1730305832 ecr 407691896], length 484
19:20:49.508325 IP ubuntu-s-1vcpu-1gb-tor1-01.ssh > cpe00fc8d403183-cm00fc8d403180.cpe.net.cable.rogers.com.62841: Flags [P.], seq 34464:35388, ack 1, win 501, options [nop,nop,TS val 1730305832 ecr 407691896], length 924
19:20:49.508502 IP ubuntu-s-1vcpu-1gb-tor1-01.ssh > cpe00fc8d403183-cm00fc8d403180.cpe.net.cable.rogers.com.62841: Flags [P.], seq 35388:35872, ack 1, win 501, options [nop,nop,TS val 1730305832 ecr 407691896], length 484
19:20:49.508690 IP ubuntu-s-1vcpu-1gb-tor1-01.ssh > cpe00fc8d403183-cm00fc8d403180.cpe.net.cable.rogers.com.62841: Flags [P.], seq 35872:36804, ack 1, win 501, options [nop,nop,TS val 1730305833 ecr 407691896], length 932
19:20:49.508861 IP ubuntu-s-1vcpu-1gb-tor1-01.ssh > cpe00fc8d403183-cm00fc8d403180.cpe.net.cable.rogers.com.62841: Flags [P.], seq 36804:37512, ack 1, win 501, options [nop,nop,TS val 1730305833 ecr 407691896], length 708
19:20:49.508984 IP ubuntu-s-1vcpu-1gb-tor1-01.ssh > cpe00fc8d403183-cm00fc8d403180.cpe.net.cable.rogers.com.62841: Flags [P.], seq 37512:37772, ack 1, win 501, options [nop,nop,TS val 1730305833 ecr 407691896], length 260
19:20:49.509086 IP ubuntu-s-1vcpu-1gb-tor1-01.ssh > cpe00fc8d403183-cm00fc8d403180.cpe.net.cable.rogers.com.62841: Flags [P.], seq 37772:38032, ack 1, win 501, options [nop,nop,TS val 1730305833 ecr 407691896], length 260
19:20:49.509346 IP ubuntu-s-1vcpu-1gb-tor1-01.ssh > cpe00fc8d403183-cm00fc8d403180.cpe.net.cable.rogers.com.62841: Flags [P.], seq 38032:38068, ack 1, win 501, options [nop,nop,TS val 1730305833 ecr 407691896], length 36
19:20:49.509665 IP ubuntu-s-1vcpu-1gb-tor1-01.ssh > cpe00fc8d403183-cm00fc8d403180.cpe.net.cable.rogers.com.62841: Flags [P.], seq 38068:39856, ack 1, win 501, options [nop,nop,TS val 1730305834 ecr 407691896], length 1788
19:20:49.525869 IP cpe00fc8d403183-cm00fc8d403180.cpe.net.cable.rogers.com.62841 > ubuntu-s-1vcpu-1gb-tor1-01.ssh: Flags [.], ack 39856, win 7002, options [nop,nop,TS val 407691999 ecr 1730305834], length 0
19:20:49.525870 IP cpe00fc8d403183-cm00fc8d403180.cpe.net.cable.rogers.com.62841 > ubuntu-s-1vcpu-1gb-tor1-01.ssh: Flags [P.], seq 1:37, ack 37772, win 7002, options [nop,nop,TS val 407691998 ecr 1730305833], length 36
19:20:49.567586 IP ubuntu-s-1vcpu-1gb-tor1-01.ssh > cpe00fc8d403183-cm00fc8d403180.cpe.net.cable.rogers.com.62841: Flags [.], ack 37, win 501, options [nop,nop,TS val 1730305892 ecr 407691998], length 0
19:20:49.612125 IP ubuntu-s-1vcpu-1gb-tor1-01.ssh > cpe00fc8d403183-cm00fc8d403180.cpe.net.cable.rogers.com.62841: Flags [P.], seq 39856:40780, ack 37, win 501, options [nop,nop,TS val 1730305936 ecr 407691998], length 924
19:20:49.612592 IP ubuntu-s-1vcpu-1gb-tor1-01.ssh > cpe00fc8d403183-cm00fc8d403180.cpe.net.cable.rogers.com.62841: Flags [P.], seq 40780:42360, ack 37, win 501, options [nop,nop,TS val 1730305937 ecr 407691998], length 1580
19:20:49.612804 IP ubuntu-s-1vcpu-1gb-tor1-01.ssh > cpe00fc8d403183-cm00fc8d403180.cpe.net.cable.rogers.com.62841: Flags [P.], seq 42360:42820, ack 37, win 501, options [nop,nop,TS val 1730305937 ecr 407691998], length 460
19:20:49.667579 IP ubuntu-s-1vcpu-1gb-tor1-01.ssh > cpe00fc8d403183-cm00fc8d403180.cpe.net.cable.rogers.com.62841: Flags [P.], seq 42360:42820, ack 37, win 501, options [nop,nop,TS val 1730305992 ecr 407691998], length 460
19:20:49.715829 IP ubuntu-s-1vcpu-1gb-tor1-01.ssh > cpe00fc8d403183-cm00fc8d403180.cpe.net.cable.rogers.com.62841: Flags [P.], seq 42820:43080, ack 37, win 501, options [nop,nop,TS val 1730306040 ecr 407691998], length 260
19:20:49.716041 IP cpe00fc8d403183-cm00fc8d403180.cpe.net.cable.rogers.com.62841 > ubuntu-s-1vcpu-1gb-tor1-01.ssh: Flags [.], ack 42820, win 7002, options [nop,nop,TS val 407692103 ecr 1730305937], length 0
19:20:49.716041 IP cpe00fc8d403183-cm00fc8d403180.cpe.net.cable.rogers.com.62841 > ubuntu-s-1vcpu-1gb-tor1-01.ssh: Flags [.], ack 42820, win 7002, options [nop,nop,TS val 407692196 ecr 1730305992,nop,nop,sack 1 {42360:42820}], length 0
19:20:49.716147 IP ubuntu-s-1vcpu-1gb-tor1-01.ssh > cpe00fc8d403183-cm00fc8d403180.cpe.net.cable.rogers.com.62841: Flags [P.], seq 43080:43796, ack 37, win 501, options [nop,nop,TS val 1730306040 ecr 407692103], length 716
19:20:49.724671 IP cpe00fc8d403183-cm00fc8d403180.cpe.net.cable.rogers.com.62841 > ubuntu-s-1vcpu-1gb-tor1-01.ssh: Flags [P.], seq 37:81, ack 42820, win 7002, options [nop,nop,TS val 407692135 ecr 1730305937], length 44
19:20:49.724671 IP cpe00fc8d403183-cm00fc8d403180.cpe.net.cable.rogers.com.62841 > ubuntu-s-1vcpu-1gb-tor1-01.ssh: Flags [.], ack 43796, win 7002, options [nop,nop,TS val 407692206 ecr 1730306040], length 0
19:20:49.724671 IP cpe00fc8d403183-cm00fc8d403180.cpe.net.cable.rogers.com.62841 > ubuntu-s-1vcpu-1gb-tor1-01.ssh: Flags [P.], seq 81:117, ack 42820, win 7002, options [nop,nop,TS val 407692141 ecr 1730305937], length 36
19:20:49.724731 IP ubuntu-s-1vcpu-1gb-tor1-01.ssh > cpe00fc8d403183-cm00fc8d403180.cpe.net.cable.rogers.com.62841: Flags [.], ack 81, win 501, options [nop,nop,TS val 1730306049 ecr 407692135], length 0
19:20:49.724791 IP ubuntu-s-1vcpu-1gb-tor1-01.ssh > cpe00fc8d403183-cm00fc8d403180.cpe.net.cable.rogers.com.62841: Flags [.], ack 117, win 501, options [nop,nop,TS val 1730306049 ecr 407692141], length 0
19:20:49.724964 IP ubuntu-s-1vcpu-1gb-tor1-01.ssh > cpe00fc8d403183-cm00fc8d403180.cpe.net.cable.rogers.com.62841: Flags [P.], seq 43796:43840, ack 117, win 501, options [nop,nop,TS val 1730306049 ecr 407692141], length 44
19:20:49.741966 IP cpe00fc8d403183-cm00fc8d403180.cpe.net.cable.rogers.com.62841 > ubuntu-s-1vcpu-1gb-tor1-01.ssh: Flags [.], ack 43840, win 7002, options [nop,nop,TS val 407692215 ecr 1730306049], length 0
19:20:49.819998 IP ubuntu-s-1vcpu-1gb-tor1-01.ssh > cpe00fc8d403183-cm00fc8d403180.cpe.net.cable.rogers.com.62841: Flags [P.], seq 43840:46260, ack 117, win 501, options [nop,nop,TS val 1730306144 ecr 407692215], length 2420
19:20:49.836914 IP cpe00fc8d403183-cm00fc8d403180.cpe.net.cable.rogers.com.62841 > ubuntu-s-1vcpu-1gb-tor1-01.ssh: Flags [.], ack 46260, win 7002, options [nop,nop,TS val 407692311 ecr 1730306144], length 0
19:20:49.923902 IP ubuntu-s-1vcpu-1gb-tor1-01.ssh > cpe00fc8d403183-cm00fc8d403180.cpe.net.cable.rogers.com.62841: Flags [P.], seq 46260:46728, ack 117, win 501, options [nop,nop,TS val 1730306248 ecr 407692311], length 468
19:20:49.944985 IP cpe00fc8d403183-cm00fc8d403180.cpe.net.cable.rogers.com.62841 > ubuntu-s-1vcpu-1gb-tor1-01.ssh: Flags [.], ack 46728, win 7002, options [nop,nop,TS val 407692416 ecr 1730306248], length 0
19:20:50.027819 IP ubuntu-s-1vcpu-1gb-tor1-01.ssh > cpe00fc8d403183-cm00fc8d403180.cpe.net.cable.rogers.com.62841: Flags [P.], seq 46728:47196, ack 117, win 501, options [nop,nop,TS val 1730306352 ecr 407692416], length 468
19:20:50.065990 IP cpe00fc8d403183-cm00fc8d403180.cpe.net.cable.rogers.com.62841 > ubuntu-s-1vcpu-1gb-tor1-01.ssh: Flags [.], ack 47196, win 7002, options [nop,nop,TS val 407692523 ecr 1730306352], length 0
19:20:50.131779 IP ubuntu-s-1vcpu-1gb-tor1-01.ssh > cpe00fc8d403183-cm00fc8d403180.cpe.net.cable.rogers.com.62841: Flags [P.], seq 47196:47664, ack 117, win 501, options [nop,nop,TS val 1730306456 ecr 407692523], length 468
19:20:50.143647 IP cpe00fc8d403183-cm00fc8d403180.cpe.net.cable.rogers.com.62841 > ubuntu-s-1vcpu-1gb-tor1-01.ssh: Flags [.], ack 47664, win 7002, options [nop,nop,TS val 407692622 ecr 1730306456], length 0
19:20:50.235841 IP ubuntu-s-1vcpu-1gb-tor1-01.ssh > cpe00fc8d403183-cm00fc8d403180.cpe.net.cable.rogers.com.62841: Flags [P.], seq 47664:48132, ack 117, win 501, options [nop,nop,TS val 1730306560 ecr 407692622], length 468
19:20:50.247736 IP cpe00fc8d403183-cm00fc8d403180.cpe.net.cable.rogers.com.62841 > ubuntu-s-1vcpu-1gb-tor1-01.ssh: Flags [.], ack 48132, win 7002, options [nop,nop,TS val 407692726 ecr 1730306560], length 0
19:20:50.339814 IP ubuntu-s-1vcpu-1gb-tor1-01.ssh > cpe00fc8d403183-cm00fc8d403180.cpe.net.cable.rogers.com.62841: Flags [P.], seq 48132:48600, ack 117, win 501, options [nop,nop,TS val 1730306664 ecr 407692726], length 468
19:20:50.351557 IP cpe00fc8d403183-cm00fc8d403180.cpe.net.cable.rogers.com.62841 > ubuntu-s-1vcpu-1gb-tor1-01.ssh: Flags [.], ack 48600, win 7002, options [nop,nop,TS val 407692830 ecr 1730306664], length 0
19:20:50.443913 IP ubuntu-s-1vcpu-1gb-tor1-01.ssh > cpe00fc8d403183-cm00fc8d403180.cpe.net.cable.rogers.com.62841: Flags [P.], seq 48600:49068, ack 117, win 501, options [nop,nop,TS val 1730306768 ecr 407692830], length 468
19:20:50.459032 IP cpe00fc8d403183-cm00fc8d403180.cpe.net.cable.rogers.com.62841 > ubuntu-s-1vcpu-1gb-tor1-01.ssh: Flags [.], ack 49068, win 7002, options [nop,nop,TS val 407692934 ecr 1730306768], length 0
19:20:50.547927 IP ubuntu-s-1vcpu-1gb-tor1-01.ssh > cpe00fc8d403183-cm00fc8d403180.cpe.net.cable.rogers.com.62841: Flags [P.], seq 49068:49536, ack 117, win 501, options [nop,nop,TS val 1730306872 ecr 407692934], length 468
19:20:50.567152 IP cpe00fc8d403183-cm00fc8d403180.cpe.net.cable.rogers.com.62841 > ubuntu-s-1vcpu-1gb-tor1-01.ssh: Flags [.], ack 49536, win 7002, options [nop,nop,TS val 407693038 ecr 1730306872], length 0
19:20:50.651907 IP ubuntu-s-1vcpu-1gb-tor1-01.ssh > cpe00fc8d403183-cm00fc8d403180.cpe.net.cable.rogers.com.62841: Flags [P.], seq 49536:50004, ack 117, win 501, options [nop,nop,TS val 1730306976 ecr 407693038], length 468
19:20:50.670914 IP cpe00fc8d403183-cm00fc8d403180.cpe.net.cable.rogers.com.62841 > ubuntu-s-1vcpu-1gb-tor1-01.ssh: Flags [.], ack 50004, win 7002, options [nop,nop,TS val 407693142 ecr 1730306976], length 0
19:20:50.755950 IP ubuntu-s-1vcpu-1gb-tor1-01.ssh > cpe00fc8d403183-cm00fc8d403180.cpe.net.cable.rogers.com.62841: Flags [P.], seq 50004:50472, ack 117, win 501, options [nop,nop,TS val 1730307080 ecr 407693142], length 468
19:20:50.770216 IP cpe00fc8d403183-cm00fc8d403180.cpe.net.cable.rogers.com.62841 > ubuntu-s-1vcpu-1gb-tor1-01.ssh: Flags [.], ack 50472, win 7002, options [nop,nop,TS val 407693247 ecr 1730307080], length 0
19:20:50.859888 IP ubuntu-s-1vcpu-1gb-tor1-01.ssh > cpe00fc8d403183-cm00fc8d403180.cpe.net.cable.rogers.com.62841: Flags [P.], seq 50472:50940, ack 117, win 501, options [nop,nop,TS val 1730307184 ecr 407693247], length 468
19:20:50.869898 IP cpe00fc8d403183-cm00fc8d403180.cpe.net.cable.rogers.com.62841 > ubuntu-s-1vcpu-1gb-tor1-01.ssh: Flags [.], ack 50940, win 7002, options [nop,nop,TS val 407693351 ecr 1730307184], length 0
19:20:50.963898 IP ubuntu-s-1vcpu-1gb-tor1-01.ssh > cpe00fc8d403183-cm00fc8d403180.cpe.net.cable.rogers.com.62841: Flags [P.], seq 50940:51408, ack 117, win 501, options [nop,nop,TS val 1730307288 ecr 407693351], length 468
19:20:50.981737 IP cpe00fc8d403183-cm00fc8d403180.cpe.net.cable.rogers.com.62841 > ubuntu-s-1vcpu-1gb-tor1-01.ssh: Flags [.], ack 51408, win 7002, options [nop,nop,TS val 407693455 ecr 1730307288], length 0
19:20:51.067777 IP ubuntu-s-1vcpu-1gb-tor1-01.ssh > cpe00fc8d403183-cm00fc8d403180.cpe.net.cable.rogers.com.62841: Flags [P.], seq 51408:51876, ack 117, win 501, options [nop,nop,TS val 1730307392 ecr 407693455], length 468
19:20:51.089832 IP cpe00fc8d403183-cm00fc8d403180.cpe.net.cable.rogers.com.62841 > ubuntu-s-1vcpu-1gb-tor1-01.ssh: Flags [.], ack 51876, win 7002, options [nop,nop,TS val 407693560 ecr 1730307392], length 0
19:20:51.171849 IP ubuntu-s-1vcpu-1gb-tor1-01.ssh > cpe00fc8d403183-cm00fc8d403180.cpe.net.cable.rogers.com.62841: Flags [P.], seq 51876:52344, ack 117, win 501, options [nop,nop,TS val 1730307496 ecr 407693560], length 468
19:20:51.189206 IP cpe00fc8d403183-cm00fc8d403180.cpe.net.cable.rogers.com.62841 > ubuntu-s-1vcpu-1gb-tor1-01.ssh: Flags [.], ack 52344, win 7002, options [nop,nop,TS val 407693662 ecr 1730307496], length 0
19:20:51.275854 IP ubuntu-s-1vcpu-1gb-tor1-01.ssh > cpe00fc8d403183-cm00fc8d403180.cpe.net.cable.rogers.com.62841: Flags [P.], seq 52344:52812, ack 117, win 501, options [nop,nop,TS val 1730307600 ecr 407693662], length 468
19:20:51.293261 IP cpe00fc8d403183-cm00fc8d403180.cpe.net.cable.rogers.com.62841 > ubuntu-s-1vcpu-1gb-tor1-01.ssh: Flags [.], ack 52812, win 7002, options [nop,nop,TS val 407693769 ecr 1730307600], length 0
201 packets captured
203 packets received by filter
0 packets dropped by kernel