root@ubuntu-s-1vcpu-1gb-tor1-01:~# tcpdump -A -i eth0
tcpdump: verbose output suppressed, use -v[v]... for full protocol decode
listening on eth0, link-type EN10MB (Ethernet), snapshot length 262144 bytes
19:14:43.820893 IP ubuntu-s-1vcpu-1gb-tor1-01.ssh > cpe00fc8d403183-cm00fc8d403180.cpe.net.cable.rogers.com.62841: Flags [P.], seq 256929387:256929495, ack 472343071, win 501, options [nop,nop,TS val 1729940145 ecr 407326288], length 108
E...2L@.@.;....@c......y.Pnk.'b............
g....GNP....C.........k.d...D|..s.R..%..cV.h.a52..q.....f3_/c@.+.zV.>S.n.............k. \.8..z....{19.DV....W. ...i.
19:14:43.821047 IP ubuntu-s-1vcpu-1gb-tor1-01.ssh > cpe00fc8d403183-cm00fc8d403180.cpe.net.cable.rogers.com.62841: Flags [P.], seq 108:264, ack 1, win 501, options [nop,nop,TS val 1729940145 ecr 407326288], length 156
E...2M@.@.;....@c......y.Pn..'b............
g....GNP.YB...\..Z.....l..-.......gd..(C6..7|Js#..#sR..p..........16....<.....J.<...Y..	...'}.. @....u<..v.F/......U	=...(.bc.+.H%....K..Ob.@i.6.3!.....6..m.3...%w.
19:14:43.821336 IP ubuntu-s-1vcpu-1gb-tor1-01.ssh > cpe00fc8d403183-cm00fc8d403180.cpe.net.cable.rogers.com.62841: Flags [P.], seq 264:368, ack 1, win 501, options [nop,nop,TS val 1729940145 ecr 407326288], length 104
E...2N@.@.;....@c......y.Pos.'b............
g....GNPn.....a..s.&O..C....o3.qp...._....v........g.qV....ZV#,....J..,..Y8.{.Ls.[l.zTel...:........l=..9.`~....
19:14:43.920401 IP ubuntu-s-1vcpu-1gb-tor1-01.47677 > 67.207.67.3.domain: 24729+ [1au] PTR? 13.154.235.99.in-addr.arpa. (55)
E..S2...@......@C.C..=.5.?U.`............13.154.235.99.in-addr.arpa.......)........
19:14:43.920585 IP ubuntu-s-1vcpu-1gb-tor1-01.35374 > 67.207.67.3.domain: Flags [S], seq 3371559929, win 64240, options [mss 1460,sackOK,TS val 1942600883 ecr 0,nop,wscale 7,tfo  cookiereq,nop,nop], length 0
E..@..@.@......@C.C....5............U..........
s..........."...
19:14:43.920929 IP ubuntu-s-1vcpu-1gb-tor1-01.51705 > 67.207.67.3.domain: 29871+ [1au] PTR? 64.46.203.159.in-addr.arpa. (55)
E..S.+..@......@C.C....5.?U.t............64.46.203.159.in-addr.arpa.......)........
19:14:43.921889 IP 67.207.67.3.domain > ubuntu-s-1vcpu-1gb-tor1-01.47677: 24729 1/0/1 PTR cpe00fc8d403183-cm00fc8d403180.cpe.net.cable.rogers.com. (124)
E...+...<...C.C....@.5.=..B.`............13.154.235.99.in-addr.arpa................9.cpe00fc8d403183-cm00fc8d403180.cpe.net.cable.rogers.com...)........
19:14:43.922028 IP 67.207.67.3.domain > ubuntu-s-1vcpu-1gb-tor1-01.51705: 29871 NXDomain 0/1/1 (122)
E.......<.	.C.C....@.5......t............64.46.203.159.in-addr.arpa..............f.7.ns1.digitalocean.com.
hostmaster..e.....*0.....	:.......)........
19:14:43.922121 IP 67.207.67.3.domain > ubuntu-s-1vcpu-1gb-tor1-01.35374: Flags [S.], seq 1925998197, ack 3371559930, win 65160, options [mss 1460,sackOK,TS val 1250327744 ecr 1942600883,nop,wscale 9], length 0
E..<..@.<...C.C....@.5..r.fu.........-.........
J.|.s......	
19:14:43.922253 IP ubuntu-s-1vcpu-1gb-tor1-01.35374 > 67.207.67.3.domain: Flags [.], ack 1, win 502, options [nop,nop,TS val 1942600884 ecr 1250327744], length 0
E..4..@.@......@C.C....5....r.fv....U......
s...J.|.
19:14:43.922306 IP ubuntu-s-1vcpu-1gb-tor1-01.51705 > 67.207.67.3.domain: 29871+ PTR? 64.46.203.159.in-addr.arpa. (44)
E..H.,..@......@C.C....5.4U#t............64.46.203.159.in-addr.arpa.....
19:14:43.922344 IP ubuntu-s-1vcpu-1gb-tor1-01.35374 > 67.207.67.3.domain: Flags [P.], seq 1:47, ack 1, win 502, options [nop,nop,TS val 1942600884 ecr 1250327744], length 46 28532+ PTR? 13.154.235.99.in-addr.arpa. (44)
E..b..@.@......@C.C....5....r.fv....U2.....
s...J.|..,ot...........13.154.235.99.in-addr.arpa.....
19:14:43.922759 IP 67.207.67.3.domain > ubuntu-s-1vcpu-1gb-tor1-01.35374: Flags [.], ack 47, win 128, options [nop,nop,TS val 1250327745 ecr 1942600884], length 0
E..4.1@.<.?.C.C....@.5..r.fv...(...........
J.|.s...
19:14:43.922820 IP 67.207.67.3.domain > ubuntu-s-1vcpu-1gb-tor1-01.51705: 29871 NXDomain 0/1/0 (111)
E.......<.	.C.C....@.5...w.?t............64.46.203.159.in-addr.arpa..............f.7.ns1.digitalocean.com.
hostmaster..e.....*0.....	:.....
19:14:43.923343 IP ubuntu-s-1vcpu-1gb-tor1-01.ssh > cpe00fc8d403183-cm00fc8d403180.cpe.net.cable.rogers.com.62841: Flags [P.], seq 368:644, ack 1, win 501, options [nop,nop,TS val 1729940247 ecr 407326288], length 276
E..H2O@.@.;M...@c......y.Po..'b......>.....
g....GNP....2...[...Y.7.).o....5.;Tu`.......t.....`8.p.......sDh....Y.B......b....,.E."...Y.=1AjWL...qb/2......].
.=.^......*U...m.6.h....Uq.......r..ON..I,.~.7..@...|...k....
.....0........m.0.F...... J.<|}G..@.z....4..#Ds..Bi...B..".......CoWbR..U..|........	.@V.9......Vf.3
.g.~..\
19:14:43.923491 IP ubuntu-s-1vcpu-1gb-tor1-01.ssh > cpe00fc8d403183-cm00fc8d403180.cpe.net.cable.rogers.com.62841: Flags [P.], seq 644:956, ack 1, win 501, options [nop,nop,TS val 1729940247 ecr 407326288], length 312
E..l2P@.@.;(...@c......y.Pp..'b......b.....
g....GNPX ..M..A../...9Y~.tx....D...Z........7h.v]k .0Z.Q.....O.].l.>.VD.(.\..Nxc.#..e...*..>.F..Y(....!Mw.....PX.n.EW}...^........j.l.C.E..c%J......9+..6k...>.....A&..OOk.0....uo..j"..._Z.'..!.-$..Y.4;Z....K.aM/7h..=k....Jh..G.w..(^.#...%.I >Y. =.Mz..,Z..t`....|K:...........}.N....dNU.cT..J1.....[aHeY.....=K../..a.S..
19:14:43.923630 IP ubuntu-s-1vcpu-1gb-tor1-01.ssh > cpe00fc8d403183-cm00fc8d403180.cpe.net.cable.rogers.com.62841: Flags [P.], seq 956:992, ack 1, win 501, options [nop,nop,TS val 1729940248 ecr 407326288], length 36
E..X2Q@.@.<;...@c......y.Pr'.'b......N.....
g....GNP..DV.fKU.-...$./4.mI.Lb.k...PE......
19:14:43.923650 IP 67.207.67.3.domain > ubuntu-s-1vcpu-1gb-tor1-01.35374: Flags [P.], seq 1:116, ack 47, win 128, options [nop,nop,TS val 1250327746 ecr 1942600884], length 115 28532 1/0/0 PTR cpe00fc8d403183-cm00fc8d403180.cpe.net.cable.rogers.com. (113)
E....2@.<.?AC.C....@.5..r.fv...(....Vs.....
J.|.s....qot...........13.154.235.99.in-addr.arpa................9.cpe00fc8d403183-cm00fc8d403180.cpe.net.cable.rogers.com.
19:14:43.923667 IP ubuntu-s-1vcpu-1gb-tor1-01.35374 > 67.207.67.3.domain: Flags [.], ack 116, win 502, options [nop,nop,TS val 1942600886 ecr 1250327746], length 0
E..4..@.@......@C.C....5...(r.f.....U......
s...J.|.
19:14:43.923810 IP ubuntu-s-1vcpu-1gb-tor1-01.ssh > cpe00fc8d403183-cm00fc8d403180.cpe.net.cable.rogers.com.62841: Flags [P.], seq 992:1244, ack 1, win 501, options [nop,nop,TS val 1729940248 ecr 407326288], length 252
E..02R@.@.;b...@c......y.PrK.'b......&.....
279 packets captured
296 packets received by filter
0 packets dropped by kernel